company_name;group;sector;subsector;main_activity;address;company_city;postcode;country;products_and_services;information;min_headcount;max_headcount;type_of_building_for_registered_address;verified_by_europages;year_established;websites;download_datetime;id
tespe;construction_public_works;thermal_insulation_materials;;manufacturer/ producer;via pizzo arera 44 | 24060 chiuduno - italy;chiuduno - italy;24060.0;italy;technical textiles for industrial applications | refractory materials and products | rubber - technical items for industry | glass fibre and wool | technical articles for industry | items for stoves and fireplaces | braided socks | technical industrial articles | rubber seals | glass fibre and wool;tespe is a highly specialised leader in the production of technical fabrics for thermal insulation and industrial sealing gaskets for high-temperature applications. rope, braid, sleeves, tape, fabrics, insulating and heat-resistant products, expansion joints. it manufactures and sells a vast range of industrial gaskets for static and dynamic sealing: special dynapack® braids for pumps and valves, sheets and gaskets in graphite and asbestos-free, semi-finished items and products in ptfe.;;;registered office – parent company;True;;https://www.tespe.it/it/, https://www.tespe.it/en/;;tespe_seac000688341-002
la misolet;construction_public_works;thermal_insulation_materials;;retailer;strada provinciale 142 4c | 26867 somaglia - italy;somaglia - italy;26867.0;italy;bakelite | plastic material processing | electrical and magnetic insulation | extruders for plastics | cutting | misoglass | bakelite canvas | plastic insulating materials | sheets of bakelite cloth | cnc turning;misolet is specialised in processing dielectric, thermo-insulating, thermo-electric, electromechanical and thermo-mechanical materials for the electronic, lighting, transport, energy and renewables sectors. for over 50 years it has been producing custom-designed components made from bakelite, bakelised fabric, bakelised paper, epoxy glass (g10, fr4, g11, fr5), melamine glass laminates (g5), silicone glass laminates (g7), polyester glass (gpo3), thermo-insulating materials (mica, misoglass1, misotherm500), thermoplastic materials, polycarbonate. it mainly offers the following processing: milling and turning on cnc machines, cutting with presses, dies and die cutting to measure in strips, panels, squares. during the course of the years it has added various services to satisfy the markets' requirements, including: calibration, grinding, (hot and cold) bending, assembly, bonding, riveting, direct selling of sheets, rods and sections.;;;registered office – parent company;True;;http://www.bachelitemisolet.it/, http://www.misolet.it/;;la-misolet_seac001036583-001
montanelli 3 s.r.l.;construction_public_works;thermal_insulation_materials;;manufacturer/ producer;via galilei 10 | 20875 burago di molgora - italy;burago di molgora - italy;20875.0;italy;thermal insulation materials | heat insulation | sound insulation for machinery | heat insulation and soundproofing materials | insulating panels for switchboards | internal protection for boxes | machine sound insulation | case linings | sound absorbing panels | insulating panels;montanelli 3 offers water cutting, milling, oscillating blade cutting and die cutting of various materials, mainly plastic and expanded materials but also leather, wood and cardboard. the company is flexible and focuses on quality, and looks both to its italian industrial past and the recent scenario of small high-tech new generation companies.;;;registered office – parent company;True;;;;montanelli-3-srl_seac009200389-001
stiferite s.p.a.;construction_public_works;thermal_insulation_materials;;manufacturer/ producer;viale della navigazione interna 54/5 | 35129 padova - italy;padova - italy;35129.0;italy;sound insulation materials | thermal insulation materials | thermal insulation for construction projects | insulation products for the building trade | stiferite | insulating panels | supplies for public works | building materials | insulation material | heat insulation;italy's leading manufacturer of thermal insulation products. pioneers in 1963 in the production of panels made from polyurethane foam, in 2000 we established a new line of lamination able to produce new stiferite panels with a polyisocyanurate foam with exceptional physical and mechanical characteristics.;;;registered office;True;;http://www.stiferite.com;;stiferite-spa_seac000901627-001
hts alte temperature srl;construction_public_works;thermal_insulation_materials;;manufacturer/ producer;cascina valsecchi 11 | 24060 costa di mezzate - italy;costa di mezzate - italy;24060.0;italy;thermal insulation materials | electrical and magnetic insulation | weatherproofing contractors | braided socks | paper and cardboard insulating materials | heat insulation panels | plates for thermal insulation | glass wool insulating materials | unwoven fabric insulating materials (geotextiles) | glass products for heat insulation;hts alte temperature applies its experience and professionalism to the manufacturing of parts for thermal insulation for average, high and very high temperatures, mainly in textiles. our product range includes yarn, cord, rope, sheaths, mats, tape, fabric, textile joints, coatings and gaskets in fibreglass and high temperature glass, vetraltemp, ceramic fibre, silica fibre, special fibres (graphite, carbon, ptfe, aramid, preox, pan).;;;registered office – parent company;True;;http://www.htsaltetemperature.com;;hts-alte-temperature-srl_seac004909159-001
isol-tech italia s.a.s;construction_public_works;thermal_insulation_materials;;manufacturer/ producer;via traversa schito 4 | 80053 castellammare di stabia - italy;castellammare di stabia - italy;80053.0;italy;thermal insulation materials | insulation material maintenance | maintenance and installation thermal insulation | air ducting | false ceilings;company founded in 1996 by the gaeta brothers with the aim of bringing innovative solutions in the thermal insulation and acoustic insulation, industrial insulation and sanitary false ceilings. isol-tech italia, relying on its specialized collaborators and continuously updated on new systems and technologies, satisfying every specific request for installation, maintenance and compliance of the systems according to the sanitary regulations in force. "our knowledge, professionalism and experience are placed at your disposal. main services: -industrial insulation cutting-edge technical designs and solutions in the installation of insulation systems for industrial and food factories. -sanitary false ceilings in pvc particularly suitable for industries, dairies and other places where it is important to mask overhead plants. the pvc ceilings also have a linear and clean design. -air ducting installation and maintenance of special ducts that allow air circulation in air conditioning systems.;1.0;10.0;;False;;https://isol-techitalia.it;;isoltech-italia-sas_00000005448938-789713001
balconi performance;construction_public_works;thermal_insulation_materials;;manufacturer/ producer;via principato, 12 | 20871 vimercate - italy;vimercate - italy;20871.0;italy;thermal insulation materials | heat-shrink sleeves | coated sleevings | accessories for electric cable protection | pvc tubes;balconi performance is an italian company specialized in the production and trade of insulating materials for the aerospace and automotive industries. the company operates in the b2b and b2c sectors and can ship its products all over the world with express delivery in a few days, operating directly from its italian headquarters in lombardy, northern italy. the main products are: fiberglass, basalt fiber, carbon fiber insulating sleevings. sleevings and tubes in silicone and pvc, heat shrink sheaths, insulating tapes and heat shields. fuel pipes, oil pipes, insulating panels for airplanes and racing cars. balconi performance can also make custom cuts and customizations on request. balconi performance can supply both large quantities of material and small quantities, thanks to a warehouse that is always supplied. many products are available in stock and can be shipped all over the world the same day. the company collaborates with many manufacturers all over the world and is able to solve any type of customer request regarding thermal and electrical insulation. contact balconi performance for a request or to get a quotation.;1.0;10.0;;False;;https://www.balconiperformance.com;;balconi-performance_00000005447706-787077001
bright star materials co., limited;construction_public_works;thermal_insulation_materials;;manufacturer/ producer;via aldo moro n.20 - | 41048 formigine - italy;formigine - italy;41048.0;italy;refractory materials and products | ceramic fibers | thermal insulation - materials | industrial furnaces;professional manufacturer and exporter of high temperature insulation products, such as ceramic fiber blanket, ceramic fiber board, ceramic fiber bulk, ceramic fiber module, ceramic fiber paper, ceramic fiber rope, ceramic fiber cloth and tape. ecological fiber products are also supplying. besides ceramic fiber, we also supply rock wool, glass wool, glass fiber, calcium silicate and other refractory materials.;51.0;100.0;;False;;http://www.pride-equip.com;;bright-star-materials-co-limited_00000005373143-686125001
eurogessi italia s.r.l.;construction_public_works;thermal_insulation_materials;;;via toti dal monte, 31 | 31053 pieve di soligo - italy;pieve di soligo - italy;31053.0;italy;thermal insulation materials | plasterboard | polyurethane | heat insulation | insulation;the company eurogessi italia s.r.l., which operates in the thermal insulation materials industry. it also operates in the plasterboard, polyurethane, heat insulation, and insulation industries. it is based in pieve di soligo, italy.;11.0;50.0;registered office – parent company;False;;;;eurogessi-italia-srl_seac000931153-001
house d'elite;construction_public_works;thermal_insulation_materials;;distributor;via dei goti | 84012 angri - italy;angri - italy;84012.0;italy;thermal insulation materials;the company house d'elite, is a distributor, founded in 2016, which operates in the thermal insulation materials industry. it is based in angri, italy.;1.0;10.0;registered office;False;2016.0;https://www.paginegialle.it/angri-sa/materiali-edilizia/house-elite;;house-delite_00000005296398-606064001
artimestieri coop. sociale;construction_public_works;thermal_insulation_materials;;manufacturer/ producer;via san mauro, 12 | 12012 boves - italy;boves - italy;12012.0;italy;thermal insulation materials;the company artimestieri coop. sociale, is a manufacturer/ producer, which operates in the thermal insulation materials industry. it is based in boves, italy.;1.0;10.0;;False;;https://store.artimestieri.com;;artimestieri-coop-sociale_00000004604678-417763001
isolveneto srl;construction_public_works;thermal_insulation_materials;;service provider;via nazionale del brennero 101 | 37029 verona - italy;verona - italy;37029.0;italy;thermal insulation materials;the company isolveneto srl, is a service provider, which operates in the thermal insulation materials industry. it is based in verona, italy.;1.0;10.0;;False;;http://www.isolveneto.it/;;isolveneto-srl_00000005279906-593655001
la plastik tex - technology thermal insulation;construction_public_works;thermal_insulation_materials;;manufacturer/ producer;via monte bernina, 10 | 20010 bareggio - italy;bareggio - italy;20010.0;italy;thermal insulation materials;the company la plastik tex - technology thermal insulation, is a manufacturer/ producer, founded in 1975, which operates in the thermal insulation materials industry. it is based in bareggio, italy.;11.0;50.0;registered office – parent company - subsidiary;False;1975.0;http://www.laplastiktex.it/;;la-plastik-tex-technology-thermal-insulation_ita319032-00101
isocold italia s.r.l.;construction_public_works;thermal_insulation_materials;;manufacturer/ producer;46 via ai vodi | 38015 lavis - italy;lavis - italy;38015.0;italy;thermal insulation materials | insulating panels | heat insulation panels;the company isocold italia s.r.l., is a manufacturer/ producer, which operates in the thermal insulation materials industry. it also operates in the insulating panels, and heat insulation panels industries. it is based in lavis, italy.;;;;False;;http://www.isocold.it;;isocold-italia-srl_seac006561802-001
tecno tape srl;construction_public_works;thermal_insulation_materials;;manufacturer/ producer;via monte bernina, 4 | 20010 bareggio - italy;bareggio - italy;20010.0;italy;thermal insulation materials;the company tecno tape srl, is a manufacturer/ producer, which operates in the thermal insulation materials industry. it is based in bareggio, italy.;1.0;10.0;;False;;http://www.tecnotape.net;;tecno-tape-srl_00000003600951-581206001
la plastik tex snc di maffi massimo & rossella;construction_public_works;thermal_insulation_materials;;manufacturer/ producer;via monte bernina, | 20010 bareggio - italy;bareggio - italy;20010.0;italy;thermal insulation materials | fibreglass fabrics;the company la plastik tex snc di maffi massimo & rossella, is a manufacturer/ producer, which operates in the thermal insulation materials industry. it also operates in the fibreglass fabrics industries. it is based in bareggio, italy.;1.0;10.0;;False;;https://www.laplastiktex.it/;;la-plastik-tex-snc-di-maffi-massimo-rossella_00000004674810-475922001
rubber project srl;construction_public_works;thermal_insulation_materials;;manufacturer/ producer;via cercone, 13 | 24060 castelli calepio - italy;castelli calepio - italy;24060.0;italy;rubber - technical items for industry | supplies for the food industry | accessories for valves | accessories for the pneumatics industry | thermal insulation - materials;the company rubber project srl, is a manufacturer/ producer, which operates in the rubber - technical items for industry industry. it also operates in the supplies for the food industry, accessories for valves, accessories for the pneumatics industry, and thermal insulation - materials industries. it is based in castelli calepio, italy.;1.0;10.0;;False;;;;rubber-project-srl_00000004730106-529034001
re.pack srl;construction_public_works;thermal_insulation_materials;;manufacturer/ producer;via antoniana 108/a | 35011 campodarsego - italy;campodarsego - italy;35011.0;italy;thermal insulation materials | working polystyrene;the company re.pack srl, is a manufacturer/ producer, founded in 2000, which operates in the thermal insulation materials industry. it also operates in the working polystyrene industries. it is based in campodarsego, italy.;1.0;10.0;registered office – parent company;False;2000.0;http://www.re-pack.it/it/;;repack-srl_00000004690951-489524001
coimperzeta sas di zoccoli giorgio & c.;construction_public_works;thermal_insulation_materials;;service provider;via messina 70/b | 20831 seregno - italy;seregno - italy;20831.0;italy;thermal insulation materials | asbestos removal | building and roof covers | waterproof sheaths | tin work;the company coimperzeta sas di zoccoli giorgio & c., is a service provider, which operates in the thermal insulation materials industry. it also operates in the asbestos removal, building and roof covers, waterproof sheaths, and tin work industries. it is based in seregno, italy.;101.0;200.0;registered office;False;;http://www.coimperzeta.net;;coimperzeta-sas-di-zoccoli-giorgio-c_00000004607753-419698001
isolmet srl;construction_public_works;thermal_insulation_materials;;;via d. alighieri, 37a | 44033 serravalle di berra (fe) - italy;serravalle di berra (fe) - italy;44033.0;italy;thermal insulation materials | polystyrene foam processing | metal structural work | insulation for buildings;the company isolmet srl, founded in 2008, which operates in the thermal insulation materials industry. it also operates in the polystyrene foam processing, metal structural work, and insulation for buildings industries. it is based in serravalle di berra (fe), italy.;;;;False;2008.0;http://www.isolmet.it;;isolmet-srl_ita318266-00101
manicolor srl;construction_public_works;thermal_insulation_materials;;service provider;via giovanni xxiii | 23855 pescate - italy;pescate - italy;23855.0;italy;thermal insulation materials | thermal coats | building maintenance | façade reconstruction | whitewashing;the company manicolor srl, is a service provider, which operates in the thermal insulation materials industry. it also operates in the thermal coats, building maintenance, façade reconstruction, and whitewashing industries. it is based in pescate, italy.;;;;False;;https://www.manicolor.it;;manicolor-srl_00000005502424-001
calvanelli nazareno s.n.c.;construction_public_works;thermal_insulation_materials;;service provider;via petrarca, 2 | 05010 porano - italy;porano - italy;5010.0;italy;thermal insulation materials | thermal insulation | insulation;the company calvanelli nazareno s.n.c., is a service provider, which operates in the thermal insulation materials industry. it also operates in the thermal insulation, and insulation industries. it is based in porano, italy.;1.0;10.0;;False;;http://www.isolamentotermico.com;;calvanelli-nazareno-snc_00000004550975-343946001
italplast s.r.l.;construction_public_works;thermal_insulation_materials;;manufacturer/ producer;614 via nuova | 47032 bertinoro - italy;bertinoro - italy;47032.0;italy;thermal insulation materials | heat insulation panels | fibreglass laminates;the company italplast s.r.l., is a manufacturer/ producer, founded in 1988, which operates in the thermal insulation materials industry. it also operates in the heat insulation panels, and fibreglass laminates industries. it is based in bertinoro, italy.;;;registered office – parent company;False;1988.0;http://www.ital-plast.it/;;italplast-srl_seac002240478-002
energycover di giancarlo dolce;construction_public_works;thermal_insulation_materials;;manufacturer/ producer;passo ponte carrega 31 r | 16141 genova - italy;genova - italy;16141.0;italy;thermal insulation materials | coat insulation | rock wool insulating materials | glass wool insulating materials | energy-saving advice;the company energycover di giancarlo dolce, is a manufacturer/ producer, which operates in the thermal insulation materials industry. it also operates in the coat insulation, rock wool insulating materials, glass wool insulating materials, and energy-saving advice industries. it is based in genova, italy.;1.0;10.0;;False;;http://www.energycovergd.it;;energycover-di-giancarlo-dolce_00000005351630-647532001
isotetto s.a.s.;construction_public_works;thermal_insulation_materials;;manufacturer/ producer;50 via camporelle | 10020 cambiano - italy;cambiano - italy;10020.0;italy;sound insulation materials | thermal insulation materials | clay, expanded - products;the company isotetto s.a.s., is a manufacturer/ producer, founded in 1999, which operates in the sound insulation materials industry. it also operates in the thermal insulation materials, and clay, expanded - products industries. it is based in cambiano, italy.;;;registered office;False;1999.0;http://www.isotetto.it;;isotetto-sas_seac001057221-001
artes s.r.l.;construction_public_works;thermal_insulation_materials;;manufacturer/ producer;15 via marconi | 24020 scanzorosciate - italy;scanzorosciate - italy;24020.0;italy;anti-corrosion products, chemical | sound insulation materials | thermal insulation materials;the company artes s.r.l., is a manufacturer/ producer, founded in 1988, which operates in the anti-corrosion products, chemical industry. it also operates in the sound insulation materials, and thermal insulation materials industries. it is based in scanzorosciate, italy.;;;registered office;False;1988.0;http://www.artesrisanamenti.it;;artes-srl_seac000556811-001
borgatta emilio s.r.l.;construction_public_works;thermal_insulation_materials;;manufacturer/ producer;13 via aspromonte | 10042 nichelino - italy;nichelino - italy;10042.0;italy;anti-corrosion products, chemical | sound insulation materials | thermal insulation materials;the company borgatta emilio s.r.l., is a manufacturer/ producer, founded in 1968, which operates in the anti-corrosion products, chemical industry. it also operates in the sound insulation materials, and thermal insulation materials industries. it is based in nichelino, italy.;11.0;50.0;registered office;False;1968.0;http://www.borgatta.com;;borgatta-emilio-srl_seac000976913-001
celenit s.p.a.;construction_public_works;thermal_insulation_materials;;manufacturer/ producer;17 via bellinghiera | 35019 tombolo - italy;tombolo - italy;35019.0;italy;sound insulation materials | thermal insulation materials | acoustic panels;the company celenit s.p.a., is a manufacturer/ producer, founded in 1963, which operates in the sound insulation materials industry. it also operates in the thermal insulation materials, and acoustic panels industries. it is based in tombolo, italy.;;;registered office;False;1963.0;http://www.celenit.com;;celenit-spa_seac000052355-001
edilfloor s.p.a.;construction_public_works;thermal_insulation_materials;;manufacturer/ producer;15 via leonardo da vinci | 36066 sandrigo - italy;sandrigo - italy;36066.0;italy;sound insulation materials | thermal insulation materials | bricks;the company edilfloor s.p.a., is a manufacturer/ producer, founded in 1974, which operates in the sound insulation materials industry. it also operates in the thermal insulation materials, and bricks industries. it is based in sandrigo, italy.;51.0;100.0;registered office;False;1974.0;http://www.edilfloor.com;;edilfloor-spa_seac000121717-001
i.p.d. s.r.l.;construction_public_works;thermal_insulation_materials;;manufacturer/ producer;307/a27 via prenestina nuova | 00036 palestrina - italy;palestrina - italy;36.0;italy;sound insulation materials | fire protection equipment | thermal insulation materials;the company i.p.d. s.r.l., is a manufacturer/ producer, founded in 1997, which operates in the sound insulation materials industry. it also operates in the fire protection equipment, and thermal insulation materials industries. it is based in palestrina, italy.;11.0;50.0;registered office;False;1997.0;http://www.cartongessoroma.com;;ipd-srl_seac000914522-001
r.i.f.a.t. s.r.l.;construction_public_works;thermal_insulation_materials;;;10 via delle industrie | 26010 bagnolo cremasco - italy;bagnolo cremasco - italy;26010.0;italy;anti-corrosion products, chemical | sound insulation materials | thermal insulation materials;the company r.i.f.a.t. s.r.l., founded in 1969, which operates in the anti-corrosion products, chemical industry. it also operates in the sound insulation materials, and thermal insulation materials industries. it is based in bagnolo cremasco, italy.;;;registered office;False;1969.0;;;rifat-srl_seac001227135-001
2pz societa' a responsabilita' limitata in sigla 2pz s.r.l.;construction_public_works;thermal_insulation_materials;;;7 via galilei g. | 29010 alseno - italy;alseno - italy;29010.0;italy;anti-corrosion products, chemical | sound insulation materials | thermal insulation materials;the company 2pz societa' a responsabilita' limitata in sigla 2pz s.r.l., founded in 2002, which operates in the anti-corrosion products, chemical industry. it also operates in the sound insulation materials, and thermal insulation materials industries. it is based in alseno, italy.;;;registered office;False;2002.0;;;2pz-societa-a-responsabilita-limitata-in-sigla-2pz-srl_seac002087627-001
over - all s.r.l.;construction_public_works;thermal_insulation_materials;;wholesaler;7/26 via di vittorio giuseppe | 20017 rho - italy;rho - italy;20017.0;italy;sound insulation materials | thermal insulation materials | clay, expanded - products;the company over - all s.r.l., is a wholesaler, founded in 2004, which operates in the sound insulation materials industry. it also operates in the thermal insulation materials, and clay, expanded - products industries. it is based in rho, italy.;;;registered office;False;2004.0;http://www.over-foil.com;;over-all-srl_seac003025072-001
braviisol divisione meccanica s.r.l.;construction_public_works;thermal_insulation_materials;;wholesaler;via adriatica | 60022 castelfidardo - italy;castelfidardo - italy;60022.0;italy;sound insulation materials | thermal insulation materials | clay, expanded - products;the company braviisol divisione meccanica s.r.l., is a wholesaler, founded in 1991, which operates in the sound insulation materials industry. it also operates in the thermal insulation materials, and clay, expanded - products industries. it is based in castelfidardo, italy.;11.0;50.0;;False;1991.0;http://www.braviisol.com;;braviisol-divisione-meccanica-srl_seac000331013-001
bosco italia s.p.a.;construction_public_works;thermal_insulation_materials;;manufacturer/ producer;16 via umbria | 10099 san mauro torinese - italy;san mauro torinese - italy;10099.0;italy;sound insulation materials | thermal insulation materials | acoustic panels;the company bosco italia s.p.a., is a manufacturer/ producer, founded in 1975, which operates in the sound insulation materials industry. it also operates in the thermal insulation materials, and acoustic panels industries. it is based in san mauro torinese, italy.;;;registered office;False;1975.0;http://www.boscoitalia.it;;bosco-italia-spa_seac000501302-001
