company_name;group;sector;subsector;main_activity;address;company_city;postcode;country;products_and_services;information;min_headcount;max_headcount;type_of_building_for_registered_address;verified_by_europages;year_established;websites;download_datetime;id
maiten di danieli osvaldo & c. s.n.c.;construction_public_works;thermal_insulation_materials;;;12 via gavardina | 25081 bedizzole - italy;bedizzole - italy;25081.0;italy;partitions | sound insulation materials | thermal insulation materials;the company maiten di danieli osvaldo & c. s.n.c., founded in 1992, which operates in the partitions industry. it also operates in the sound insulation materials, and thermal insulation materials industries. it is based in bedizzole, italy.;11.0;50.0;registered office;False;1992.0;;;maiten-di-danieli-osvaldo-c-snc_seac000496148-001
ra.ri.ca. s.r.l.;construction_public_works;thermal_insulation_materials;;service provider;2 viale dell' artigianato | 35020 san pietro viminario - italy;san pietro viminario - italy;35020.0;italy;sound insulation materials | thermal insulation materials | weatherproofing contractors;the company ra.ri.ca. s.r.l., is a service provider, founded in 1985, which operates in the sound insulation materials industry. it also operates in the thermal insulation materials, and weatherproofing contractors industries. it is based in san pietro viminario, italy.;;;registered office;False;1985.0;;;rarica-srl_seac000603360-001
ivas industria vernici s.p.a.;construction_public_works;thermal_insulation_materials;;manufacturer/ producer;40 via bellaria | 47030 san mauro pascoli - italy;san mauro pascoli - italy;47030.0;italy;paints and varnishes | sound insulation materials | thermal insulation materials;the company ivas industria vernici s.p.a., is a manufacturer/ producer, founded in 1953, which operates in the paints and varnishes industry. it also operates in the sound insulation materials, and thermal insulation materials industries. it is based in san mauro pascoli, italy.;;;registered office;False;1953.0;;;ivas-industria-vernici-spa_seac000025760-001
texpack s.r.l.;construction_public_works;thermal_insulation_materials;;manufacturer/ producer;24 via bornico | 25030 adro - italy;adro - italy;25030.0;italy;sound insulation materials | thermal insulation materials | expansion joints - non-ferrous metal;the company texpack s.r.l., is a manufacturer/ producer, which operates in the sound insulation materials industry. it also operates in the thermal insulation materials, and expansion joints - non-ferrous metal industries. it is based in adro, italy.;11.0;50.0;registered office;False;;;;texpack-srl_seac005197297-001
limblici & aleo s.n.c. di limblici & c.;construction_public_works;thermal_insulation_materials;;service provider;125 via berlinguer enrico | 92026 favara - italy;favara - italy;92026.0;italy;sound insulation materials | thermal insulation materials | fireplaces and stoves, ornamental and accessories;the company limblici & aleo s.n.c. di limblici & c., is a service provider, founded in 1987, which operates in the sound insulation materials industry. it also operates in the thermal insulation materials, and fireplaces and stoves, ornamental and accessories industries. it is based in favara, italy.;;;registered office;False;1987.0;;;limblici-aleo-snc-di-limblici-c_seac000473935-001
vetrolux s.r.l.;construction_public_works;thermal_insulation_materials;;manufacturer/ producer;23 via sansovino andrea | 48124 ravenna - italy;ravenna - italy;48124.0;italy;glass | sound insulation materials | thermal insulation materials;the company vetrolux s.r.l., is a manufacturer/ producer, founded in 1992, which operates in the glass industry. it also operates in the sound insulation materials, and thermal insulation materials industries. it is based in ravenna, italy.;;;registered office;False;1992.0;;;vetrolux-srl_seac000145234-001
g.m.c. isolamenti;construction_public_works;thermal_insulation_materials;;service provider;31/a via sella quintino | 43126 parma - italy;parma - italy;43126.0;italy;sound insulation materials | thermal insulation materials | roofing materials;the company g.m.c. isolamenti, is a service provider, founded in 1988, which operates in the sound insulation materials industry. it also operates in the thermal insulation materials, and roofing materials industries. it is based in parma, italy.;11.0;50.0;registered office;False;1988.0;;;gmc-isolamenti_seac000482180-001
matra int s.r.l.;construction_public_works;thermal_insulation_materials;;manufacturer/ producer;43 via po | 20010 pregnana milanese - italy;pregnana milanese - italy;20010.0;italy;sound insulation materials | ovens, kilns, furnaces and hearths, industrial | thermal insulation materials;the company matra int s.r.l., is a manufacturer/ producer, founded in 1990, which operates in the sound insulation materials industry. it also operates in the ovens, kilns, furnaces and hearths, industrial, and thermal insulation materials industries. it is based in pregnana milanese, italy.;11.0;50.0;registered office;False;1990.0;;;matra-int-srl_seac001085970-001
geos italy s.r.l.;construction_public_works;thermal_insulation_materials;;manufacturer/ producer;20 via cirie' | 10099 san mauro torinese - italy;san mauro torinese - italy;10099.0;italy;anti-corrosion products, chemical | sound insulation materials | thermal insulation materials;the company geos italy s.r.l., is a manufacturer/ producer, founded in 2006, which operates in the anti-corrosion products, chemical industry. it also operates in the sound insulation materials, and thermal insulation materials industries. it is based in san mauro torinese, italy.;11.0;50.0;registered office;False;2006.0;;;geos-italy-srl_seac003401865-001
edil - spezia s.r.l.;construction_public_works;thermal_insulation_materials;;;19 via olivieri nello | 19123 la spezia - italy;la spezia - italy;19123.0;italy;sound insulation materials | raw materials for construction and public works | thermal insulation materials;the company edil - spezia s.r.l., founded in 1975, which operates in the sound insulation materials industry. it also operates in the raw materials for construction and public works, and thermal insulation materials industries. it is based in la spezia, italy.;11.0;50.0;;False;1975.0;;;edil-spezia-srl_seac000033227-001
isolmap s.r.l.;construction_public_works;thermal_insulation_materials;;service provider;93 via s. vecchia | 23868 valmadrera - italy;valmadrera - italy;23868.0;italy;sound insulation materials | thermal insulation materials | ceilings;the company isolmap s.r.l., is a service provider, founded in 2002, which operates in the sound insulation materials industry. it also operates in the thermal insulation materials, and ceilings industries. it is based in valmadrera, italy.;;;registered office;False;2002.0;;;isolmap-srl_seac000784331-001
i.t.a.;construction_public_works;thermal_insulation_materials;;service provider;8/b via cellini | 33077 sacile - italy;sacile - italy;33077.0;italy;thermal insulation materials | weatherproofing contractors | clay, expanded - products;the company i.t.a., is a service provider, founded in 2006, which operates in the thermal insulation materials industry. it also operates in the weatherproofing contractors, and clay, expanded - products industries. it is based in sacile, italy.;11.0;50.0;registered office;False;2006.0;;;ita_seac004990289-001
olivero antonio & figli s.n.c.;construction_public_works;thermal_insulation_materials;;manufacturer/ producer;177/b via torino | 12048 sommariva del bosco - italy;sommariva del bosco - italy;12048.0;italy;sound insulation materials | plastics - industrial raw materials | thermal insulation materials;the company olivero antonio & figli s.n.c., is a manufacturer/ producer, founded in 1982, which operates in the sound insulation materials industry. it also operates in the plastics - industrial raw materials, and thermal insulation materials industries. it is based in sommariva del bosco, italy.;;;registered office;False;1982.0;;;olivero-antonio-figli-snc_seac000439241-001
impresa camele alfredo;construction_public_works;thermal_insulation_materials;;;9 via ravaz | 10040 la loggia - italy;la loggia - italy;10040.0;italy;construction - finishings | sound insulation materials | thermal insulation materials;the company impresa camele alfredo, founded in 2004, which operates in the construction - finishings industry. it also operates in the sound insulation materials, and thermal insulation materials industries. it is based in la loggia, italy.;1.0;10.0;;False;2004.0;;;impresa-camele-alfredo_seac005816128-001
barresi gianpaolo;construction_public_works;thermal_insulation_materials;;;contrada staglio | 94100 enna - italy;enna - italy;94100.0;italy;sound insulation materials | thermal insulation materials | ceilings;the company barresi gianpaolo, founded in 2006, which operates in the sound insulation materials industry. it also operates in the thermal insulation materials, and ceilings industries. it is based in enna, italy.;1.0;10.0;registered office;False;2006.0;;;barresi-gianpaolo_seac000164050-001
tim color service s.r.l.;construction_public_works;thermal_insulation_materials;;service provider;43 via della lirica | 48124 ravenna - italy;ravenna - italy;48124.0;italy;anti-corrosion products, chemical | sound insulation materials | thermal insulation materials;the company tim color service s.r.l., is a service provider, which operates in the anti-corrosion products, chemical industry. it also operates in the sound insulation materials, and thermal insulation materials industries. it is based in ravenna, italy.;;;registered office;False;;;;tim-color-service-srl_seac005274147-001
m.b. fiber s.r.l.;construction_public_works;thermal_insulation_materials;;subcontractor;3/5/7/9 via dell' artigianato | 44027 fiscaglia - italy;fiscaglia - italy;44027.0;italy;thermal insulation materials | glass fibre and wool | glass fibres;the company m.b. fiber s.r.l., is a subcontractor, founded in 1990, which operates in the thermal insulation materials industry. it also operates in the glass fibre and wool, and glass fibres industries. it is based in fiscaglia, italy.;;;registered office;False;1990.0;;;mb-fiber-srl_seac000305230-001
campi astucci s.n.c.;construction_public_works;thermal_insulation_materials;;manufacturer/ producer;657 via cerro | 47832 san clemente - italy;san clemente - italy;47832.0;italy;sound insulation materials | thermal insulation materials | clay, expanded - products;the company campi astucci s.n.c., is a manufacturer/ producer, founded in 2006, which operates in the sound insulation materials industry. it also operates in the thermal insulation materials, and clay, expanded - products industries. it is based in san clemente, italy.;1.0;10.0;registered office;False;2006.0;;;campi-astucci-snc_seac002878985-001
ecomat s.r.l.;construction_public_works;thermal_insulation_materials;;manufacturer/ producer;20 via v. al mare | 47842 san giovanni in marignano - italy;san giovanni in marignano - italy;47842.0;italy;sound insulation materials | thermal insulation materials | coatings, putties and sealing products;the company ecomat s.r.l., is a manufacturer/ producer, founded in 1990, which operates in the sound insulation materials industry. it also operates in the thermal insulation materials, and coatings, putties and sealing products industries. it is based in san giovanni in marignano, italy.;;;registered office;False;1990.0;;;ecomat-srl_seac005296883-001
r.i.v. s.r.l.;construction_public_works;thermal_insulation_materials;;;rigolli luigi | 29122 piacenza - italy;piacenza - italy;29122.0;italy;sound insulation materials | thermal insulation materials | ceilings;the company r.i.v. s.r.l., which operates in the sound insulation materials industry. it also operates in the thermal insulation materials, and ceilings industries. it is based in piacenza, italy.;;;registered office;False;;;;riv-srl_seac005660964-001
isodelta ( s.n.c. );construction_public_works;thermal_insulation_materials;;;5 via bianca lancia di agliano | 14100 asti - italy;asti - italy;14100.0;italy;sound insulation materials | thermal insulation materials | clay, expanded - products;the company isodelta ( s.n.c. ), founded in 1975, which operates in the sound insulation materials industry. it also operates in the thermal insulation materials, and clay, expanded - products industries. it is based in asti, italy.;;;registered office;False;1975.0;;;isodelta-snc-_seac000028663-001
ediltermika s.r.l.;construction_public_works;thermal_insulation_materials;;service provider;5 corso europa | 37038 soave - italy;soave - italy;37038.0;italy;sound insulation materials | anti-corrosion products, chemical | thermal insulation materials;the company ediltermika s.r.l., is a service provider, founded in 2000, which operates in the sound insulation materials industry. it also operates in the anti-corrosion products, chemical, and thermal insulation materials industries. it is based in soave, italy.;11.0;50.0;registered office;False;2000.0;;;ediltermika-srl_seac000831889-001
comaco italiana s.p.a.;construction_public_works;thermal_insulation_materials;;manufacturer/ producer;1 via fiume ronco | 47100 forli' - italy;forli' - italy;47100.0;italy;sound insulation materials | thermal insulation materials | clay, expanded - products;the company comaco italiana s.p.a., is a manufacturer/ producer, which operates in the sound insulation materials industry. it also operates in the thermal insulation materials, and clay, expanded - products industries. it is based in forli', italy.;11.0;50.0;registered office;False;;;;comaco-italiana-spa_seac005197363-001
montaggi & impianti srl;construction_public_works;thermal_insulation_materials;;service provider;riccardo sineo | 15045 sale (al) - italy;sale (al) - italy;15045.0;italy;thermal insulation materials;the company montaggi & impianti srl, is a service provider, which operates in the thermal insulation materials industry. it is based in sale (al), italy.;11.0;50.0;;False;;http://www.montaggieimpianti.it;;montaggi-impianti-srl_sea269837702-00101
isoltech;construction_public_works;thermal_insulation_materials;;manufacturer/ producer;26 via berlino | 24040 verdellino - italy;verdellino - italy;24040.0;italy;anti-corrosion products, chemical | sound insulation materials | thermal insulation materials;the company isoltech, is a manufacturer/ producer, founded in 1987, which operates in the anti-corrosion products, chemical industry. it also operates in the sound insulation materials, and thermal insulation materials industries. it is based in verdellino, italy.;11.0;50.0;registered office;False;1987.0;;;isoltech_seac000535894-001
tortalla isolanti s.r.l.;construction_public_works;thermal_insulation_materials;;wholesaler;25 via leonardo da vinci | 10095 grugliasco - italy;grugliasco - italy;10095.0;italy;sound insulation materials | thermal insulation materials | ceilings;the company tortalla isolanti s.r.l., is a wholesaler, founded in 1993, which operates in the sound insulation materials industry. it also operates in the thermal insulation materials, and ceilings industries. it is based in grugliasco, italy.;11.0;50.0;registered office;False;1993.0;;;tortalla-isolanti-srl_seac001025274-001
cbf s.r.l.;construction_public_works;thermal_insulation_materials;;manufacturer/ producer;88 via cassala | 25126 brescia - italy;brescia - italy;25126.0;italy;environment - services | sound insulation materials | thermal insulation materials;the company cbf s.r.l., is a manufacturer/ producer, founded in 1981, which operates in the environment - services industry. it also operates in the sound insulation materials, and thermal insulation materials industries. it is based in brescia, italy.;11.0;50.0;registered office;False;1981.0;;;cbf-srl_seac000469563-001
baldoni s.n.c. di baldoni samuele & raffaele;construction_public_works;thermal_insulation_materials;;service provider;3 via dei gladioli | 62019 recanati - italy;recanati - italy;62019.0;italy;raw materials for construction and public works | sound insulation materials | thermal insulation materials;the company baldoni s.n.c. di baldoni samuele & raffaele, is a service provider, which operates in the raw materials for construction and public works industry. it also operates in the sound insulation materials, and thermal insulation materials industries. it is based in recanati, italy.;;;registered office;False;;;;baldoni-snc-di-baldoni-samuele-raffaele_seac001992073-001
nuova isoclimat s.r.l.;construction_public_works;thermal_insulation_materials;;wholesaler;75 viale de matteis salvatore | 73042 casarano - italy;casarano - italy;73042.0;italy;sound insulation materials | thermal insulation materials | clay, expanded - products;the company nuova isoclimat s.r.l., is a wholesaler, founded in 1995, which operates in the sound insulation materials industry. it also operates in the thermal insulation materials, and clay, expanded - products industries. it is based in casarano, italy.;1.0;10.0;;False;1995.0;;;nuova-isoclimat-srl_seac000830428-001
emmeci di porporino s.n.c.;construction_public_works;thermal_insulation_materials;;;10 via borsi giosue' | 10143 torino - italy;torino - italy;10143.0;italy;anti-corrosion products, chemical | sound insulation materials | thermal insulation materials;the company emmeci di porporino s.n.c., founded in 1986, which operates in the anti-corrosion products, chemical industry. it also operates in the sound insulation materials, and thermal insulation materials industries. it is based in torino, italy.;;;registered office;False;1986.0;http://www.paginebianche.it/emmeci-torino;;emmeci-di-porporino-snc_seac000982872-001
bauma s.r.l.;construction_public_works;thermal_insulation_materials;;service provider;33 localita' zona artigianale | 39052 caldaro sulla strada del vino - italy;caldaro sulla strada del vino - italy;39052.0;italy;sound insulation materials | thermal insulation materials | coatings, putties and sealing products;the company bauma s.r.l., is a service provider, founded in 2004, which operates in the sound insulation materials industry. it also operates in the thermal insulation materials, and coatings, putties and sealing products industries. it is based in caldaro sulla strada del vino, italy.;;;registered office;False;2004.0;;;bauma-srl_seac004660556-001
isol casa s.r.l.;construction_public_works;thermal_insulation_materials;;;13 via i maggio | 24060 solto collina - italy;solto collina - italy;24060.0;italy;anti-corrosion products, chemical | sound insulation materials | thermal insulation materials;the company isol casa s.r.l., which operates in the anti-corrosion products, chemical industry. it also operates in the sound insulation materials, and thermal insulation materials industries. it is based in solto collina, italy.;;;registered office;False;;;;isol-casa-srl_seac006795196-001
commerciale isonzo s.r.l.;construction_public_works;thermal_insulation_materials;;wholesaler;120 via della stazione tuscolana | 00182 roma - italy;roma - italy;182.0;italy;construction materials | sound insulation materials | thermal insulation materials;the company commerciale isonzo s.r.l., is a wholesaler, founded in 1992, which operates in the construction materials industry. it also operates in the sound insulation materials, and thermal insulation materials industries. it is based in roma, italy.;;;registered office;False;1992.0;;;commerciale-isonzo-srl_seac000216877-001
sugherificio peppino puliga s.r.l.;construction_public_works;thermal_insulation_materials;;;localita' isticcadeddu | 07026 olbia - italy;olbia - italy;7026.0;italy;cork products | sound insulation materials | thermal insulation materials;the company sugherificio peppino puliga s.r.l., which operates in the cork products industry. it also operates in the sound insulation materials, and thermal insulation materials industries. it is based in olbia, italy.;;;;False;;;;sugherificio-peppino-puliga-srl_seac000413781-001
s.i.s.a.f. s.r.l.;construction_public_works;thermal_insulation_materials;;wholesaler;59 via vittorio emanuele | 09071 abbasanta - italy;abbasanta - italy;9071.0;italy;cork products | sound insulation materials | thermal insulation materials;the company s.i.s.a.f. s.r.l., is a wholesaler, founded in 1959, which operates in the cork products industry. it also operates in the sound insulation materials, and thermal insulation materials industries. it is based in abbasanta, italy.;;;registered office;False;1959.0;https://www.sugherificiosisaf.it/;;sisaf-srl_seac000006105-001
isocoperture s.n.c. del geom. giuntini simone e c.;construction_public_works;thermal_insulation_materials;;;201 via matteo degli organi | 59100 prato - italy;prato - italy;59100.0;italy;construction materials | sound insulation materials | thermal insulation materials;the company isocoperture s.n.c. del geom. giuntini simone e c., founded in 2002, which operates in the construction materials industry. it also operates in the sound insulation materials, and thermal insulation materials industries. it is based in prato, italy.;11.0;50.0;;False;2002.0;https://www.isolcopertureprato.it/;;isocoperture-snc-del-geom-giuntini-simone-e-c_seac005197661-001
iso-mar;construction_public_works;thermal_insulation_materials;;wholesaler;5 contrada piccoli | 72100 brindisi - italy;brindisi - italy;72100.0;italy;sound insulation materials | thermal insulation materials | clay, expanded - products;the company iso-mar, is a wholesaler, founded in 1983, which operates in the sound insulation materials industry. it also operates in the thermal insulation materials, and clay, expanded - products industries. it is based in brindisi, italy.;;;registered office;False;1983.0;http://web.tiscalinet.it/isomar;;isomar_seac001481794-001
proietto di giovanni proietto e c. s.n.c.;construction_public_works;thermal_insulation_materials;;;84/c viale spagna | 20093 cologno monzese - italy;cologno monzese - italy;20093.0;italy;sound insulation materials | thermal insulation materials | weatherproofing contractors;the company proietto di giovanni proietto e c. s.n.c., founded in 1988, which operates in the sound insulation materials industry. it also operates in the thermal insulation materials, and weatherproofing contractors industries. it is based in cologno monzese, italy.;;;registered office;False;1988.0;http://www.paginegialle.it/proiettosnc;;proietto-di-giovanni-proietto-e-c-snc_seac001079546-001
na.ma. s.r.l.;construction_public_works;thermal_insulation_materials;;wholesaler;116/a via strada regionale 443 | 45010 villadose - italy;villadose - italy;45010.0;italy;anti-corrosion products, chemical | sound insulation materials | thermal insulation materials;the company na.ma. s.r.l., is a wholesaler, founded in 1976, which operates in the anti-corrosion products, chemical industry. it also operates in the sound insulation materials, and thermal insulation materials industries. it is based in villadose, italy.;;;registered office;False;1976.0;;;nama-srl_seac000046042-001
work italia s.r.l.;construction_public_works;thermal_insulation_materials;;manufacturer/ producer;24 via keplero giovanni | 20019 settimo milanese - italy;settimo milanese - italy;20019.0;italy;anti-corrosion products, chemical | sound insulation materials | thermal insulation materials;the company work italia s.r.l., is a manufacturer/ producer, founded in 1986, which operates in the anti-corrosion products, chemical industry. it also operates in the sound insulation materials, and thermal insulation materials industries. it is based in settimo milanese, italy.;;;registered office;False;1986.0;http://www.workitalia.it;;work-italia-srl_seac003350154-001
lci s.r.l.;construction_public_works;thermal_insulation_materials;;service provider;3 via friuli | 30034 mira - italy;mira - italy;30034.0;italy;anti-corrosion products, chemical | sound insulation materials | thermal insulation materials;the company lci s.r.l., is a service provider, founded in 1993, which operates in the anti-corrosion products, chemical industry. it also operates in the sound insulation materials, and thermal insulation materials industries. it is based in mira, italy.;11.0;50.0;registered office;False;1993.0;http://www.lci.it;;lci-srl_seac000775083-001
termotetto;construction_public_works;thermal_insulation_materials;;wholesaler;8 via s. tommaso d'aquino | 21100 varese - italy;varese - italy;21100.0;italy;sound insulation materials | thermal insulation materials | clay, expanded - products;the company termotetto, is a wholesaler, founded in 1976, which operates in the sound insulation materials industry. it also operates in the thermal insulation materials, and clay, expanded - products industries. it is based in varese, italy.;1.0;10.0;registered office;False;1976.0;;;termotetto_seac000105790-001
acustermik s.r.l.;construction_public_works;thermal_insulation_materials;;service provider;petraglione giuseppe | 70125 bari - italy;bari - italy;70125.0;italy;sound insulation materials | thermal insulation materials | weatherproofing contractors;the company acustermik s.r.l., is a service provider, which operates in the sound insulation materials industry. it also operates in the thermal insulation materials, and weatherproofing contractors industries. it is based in bari, italy.;;;;False;;;;acustermik-srl_seac001008196-001
