company_name;group;sector;subsector;main_activity;address;company_city;postcode;country;products_and_services;information;min_headcount;max_headcount;type_of_building_for_registered_address;verified_by_europages;year_established;websites;download_datetime;id
eurofix s.r.l.;construction_public_works;thermal_insulation_materials;;manufacturer/ producer;consorzio | 60020 agugliano - italy;agugliano - italy;60020.0;italy;sound insulation materials | fastening devices | thermal insulation materials;the company eurofix s.r.l., is a manufacturer/ producer, which operates in the sound insulation materials industry. it also operates in the fastening devices, and thermal insulation materials industries. it is based in agugliano, italy.;;;;False;;;;eurofix-srl_seac000638519-001
edil color s.r.l.;construction_public_works;thermal_insulation_materials;;wholesaler;443 via cavour camillo benso | 67051 avezzano - italy;avezzano - italy;67051.0;italy;raw materials for construction and public works | sound insulation materials | thermal insulation materials;the company edil color s.r.l., is a wholesaler, founded in 2001, which operates in the raw materials for construction and public works industry. it also operates in the sound insulation materials, and thermal insulation materials industries. it is based in avezzano, italy.;;;registered office;False;2001.0;;;edil-color-srl_seac000448084-001
isokap systems s.r.l.;construction_public_works;thermal_insulation_materials;;service provider;1 via ripa | 24030 caprino bergamasco - italy;caprino bergamasco - italy;24030.0;italy;anti-corrosion products, chemical | sound insulation materials | thermal insulation materials;the company isokap systems s.r.l., is a service provider, which operates in the anti-corrosion products, chemical industry. it also operates in the sound insulation materials, and thermal insulation materials industries. it is based in caprino bergamasco, italy.;;;registered office;False;;;;isokap-systems-srl_seac006054760-001
dbel s.r.l.;construction_public_works;thermal_insulation_materials;;wholesaler;41 via aspesi gaetano | 21017 samarate - italy;samarate - italy;21017.0;italy;sound insulation materials | thermal insulation materials | clay, expanded - products;the company dbel s.r.l., is a wholesaler, founded in 2006, which operates in the sound insulation materials industry. it also operates in the thermal insulation materials, and clay, expanded - products industries. it is based in samarate, italy.;;;;False;2006.0;http://www.dbel.it;;dbel-srl_seac002714644-001
cib s.r.l.;construction_public_works;thermal_insulation_materials;;manufacturer/ producer;1 via matteotti giacomo | 45030 villamarzana - italy;villamarzana - italy;45030.0;italy;anti-corrosion products, chemical | sound insulation materials | thermal insulation materials;the company cib s.r.l., is a manufacturer/ producer, founded in 1984, which operates in the anti-corrosion products, chemical industry. it also operates in the sound insulation materials, and thermal insulation materials industries. it is based in villamarzana, italy.;;;;False;1984.0;http://www.cibonline.it;;cib-srl_seac001589265-001
visim s.r.l.;construction_public_works;thermal_insulation_materials;;;20 viale delle industrie | 20881 bernareggio - italy;bernareggio - italy;20881.0;italy;sound insulation materials | thermal insulation materials | clay, expanded - products;the company visim s.r.l., founded in 1992, which operates in the sound insulation materials industry. it also operates in the thermal insulation materials, and clay, expanded - products industries. it is based in bernareggio, italy.;11.0;50.0;registered office;False;1992.0;http://www.visim.it;;visim-srl_seac005782932-001
3 therm s.r.l.;construction_public_works;thermal_insulation_materials;;wholesaler;7 via del bersaglio | 39040 montagna - italy;montagna - italy;39040.0;italy;sound insulation materials | anti-corrosion products, chemical | thermal insulation materials;the company 3 therm s.r.l., is a wholesaler, founded in 2005, which operates in the sound insulation materials industry. it also operates in the anti-corrosion products, chemical, and thermal insulation materials industries. it is based in montagna, italy.;;;registered office;False;2005.0;http://www.3therm.it/;;3-therm-srl_seac002128236-001
resin art srls;construction_public_works;thermal_insulation_materials;;;12 via dell' artigianato | 40023 castel guelfo di bologna - italy;castel guelfo di bologna - italy;40023.0;italy;thermal insulation materials | glass fibre and wool;the company resin art srls, which operates in the thermal insulation materials industry. it also operates in the glass fibre and wool industries. it is based in castel guelfo di bologna, italy.;11.0;50.0;registered office;False;;;;resin-art-srls_seac006908625-001
bachl italia s.r.l.;construction_public_works;thermal_insulation_materials;;wholesaler;18 via abarth carlo | 39012 merano - italy;merano - italy;39012.0;italy;sound insulation materials | thermal insulation materials | clay, expanded - products;the company bachl italia s.r.l., is a wholesaler, which operates in the sound insulation materials industry. it also operates in the thermal insulation materials, and clay, expanded - products industries. it is based in merano, italy.;;;registered office;False;;;;bachl-italia-srl_seac005273849-001
insultech s.r.l.;construction_public_works;thermal_insulation_materials;;manufacturer/ producer;27 via pusterla | 20826 misinto - italy;misinto - italy;20826.0;italy;sound insulation materials | thermal insulation materials | clay, expanded - products;the company insultech s.r.l., is a manufacturer/ producer, which operates in the sound insulation materials industry. it also operates in the thermal insulation materials, and clay, expanded - products industries. it is based in misinto, italy.;11.0;50.0;registered office;False;;http://www.insultech.it;;insultech-srl_seac005024456-001
spataro giovanni giovanni;construction_public_works;thermal_insulation_materials;;wholesaler;43 via cellini benvenuto | 50028 barberino tavarnelle - italy;barberino tavarnelle - italy;50028.0;italy;sound insulation materials | thermal insulation materials | clay, expanded - products;the company spataro giovanni giovanni, is a wholesaler, founded in 1959, which operates in the sound insulation materials industry. it also operates in the thermal insulation materials, and clay, expanded - products industries. it is based in barberino tavarnelle, italy.;11.0;50.0;registered office;False;1959.0;;;spataro-giovanni-giovanni_seac000091018-001
ital 2 b s.r.l.;construction_public_works;thermal_insulation_materials;;wholesaler;57/a via silicella | 00169 roma - italy;roma - italy;169.0;italy;ceilings | sound insulation materials | thermal insulation materials;the company ital 2 b s.r.l., is a wholesaler, founded in 1999, which operates in the ceilings industry. it also operates in the sound insulation materials, and thermal insulation materials industries. it is based in roma, italy.;11.0;50.0;;False;1999.0;;;ital-2-b-srl_seac000982947-001
aktarus group s.r.l.;construction_public_works;thermal_insulation_materials;;wholesaler;451 via cattaneo carlo | 24033 calusco d'adda - italy;calusco d'adda - italy;24033.0;italy;sound insulation materials | thermal insulation materials | clay, expanded - products;the company aktarus group s.r.l., is a wholesaler, which operates in the sound insulation materials industry. it also operates in the thermal insulation materials, and clay, expanded - products industries. it is based in calusco d'adda, italy.;;;registered office;False;;;;aktarus-group-srl_seac006502173-001
solai villa s.r.l.;construction_public_works;thermal_insulation_materials;;wholesaler;2 via alle cave | 20029 turbigo - italy;turbigo - italy;20029.0;italy;construction materials | sound insulation materials | thermal insulation materials;the company solai villa s.r.l., is a wholesaler, founded in 1954, which operates in the construction materials industry. it also operates in the sound insulation materials, and thermal insulation materials industries. it is based in turbigo, italy.;;;registered office;False;1954.0;;;solai-villa-srl_seac000170558-001
futura commerciale di zecchino domenico;construction_public_works;thermal_insulation_materials;;;40 contrada bosco | 83037 montecalvo irpino - italy;montecalvo irpino - italy;83037.0;italy;sound insulation materials | thermal insulation materials | clay, expanded - products;the company futura commerciale di zecchino domenico, which operates in the sound insulation materials industry. it also operates in the thermal insulation materials, and clay, expanded - products industries. it is based in montecalvo irpino, italy.;1.0;10.0;;False;;http://www.paginegialle.it/futuracommerciale_fhagib;;futura-commerciale-di-zecchino-domenico_seac008011786-001
c. & b. colombi s.r.l.;construction_public_works;thermal_insulation_materials;;service provider;2 via battisti | 24024 gandino - italy;gandino - italy;24024.0;italy;furnishings - accessories and decorative objects | sound insulation materials | thermal insulation materials;the company c. & b. colombi s.r.l., is a service provider, founded in 2004, which operates in the furnishings - accessories and decorative objects industry. it also operates in the sound insulation materials, and thermal insulation materials industries. it is based in gandino, italy.;11.0;50.0;registered office;False;2004.0;;;c-b-colombi-srl_seac000837538-001
union foam spa;construction_public_works;thermal_insulation_materials;;manufacturer/ producer;via dell' industria 11 | 20040 bellusco - italy;bellusco - italy;20040.0;italy;rubber products | rubber - products for the construction industry | thermal insulation materials | acoustic insulation - materials;the company union foam spa, is a manufacturer/ producer, which operates in the rubber products industry. it also operates in the rubber - products for the construction industry, thermal insulation materials, and acoustic insulation - materials industries. it is based in bellusco, italy.;51.0;100.0;;False;;http://www.unionfoam.it;;union-foam-spa_ita040432-00101
mibo s.r.l.;construction_public_works;thermal_insulation_materials;;wholesaler;32 via galileo galilei | 36040 brendola - italy;brendola - italy;36040.0;italy;sound insulation materials | thermal insulation materials | clay, expanded - products;the company mibo s.r.l., is a wholesaler, which operates in the sound insulation materials industry. it also operates in the thermal insulation materials, and clay, expanded - products industries. it is based in brendola, italy.;11.0;50.0;;False;;http://www.mibosrl.it;;mibo-srl_seac002060404-001
lam industries s.r.l.;construction_public_works;thermal_insulation_materials;;manufacturer/ producer;8 via querenga | 31052 maserada sul piave - italy;maserada sul piave - italy;31052.0;italy;sound insulation materials | thermal insulation materials | clay, expanded - products;the company lam industries s.r.l., is a manufacturer/ producer, founded in 1996, which operates in the sound insulation materials industry. it also operates in the thermal insulation materials, and clay, expanded - products industries. it is based in maserada sul piave, italy.;;;;False;1996.0;http://www.lamindustries.eu;;lam-industries-srl_seac000845844-001
isolamenti s.r.l.;construction_public_works;thermal_insulation_materials;;wholesaler;27 strada prati | 65124 pescara - italy;pescara - italy;65124.0;italy;sound insulation materials | thermal insulation materials | clay, expanded - products;the company isolamenti s.r.l., is a wholesaler, founded in 1992, which operates in the sound insulation materials industry. it also operates in the thermal insulation materials, and clay, expanded - products industries. it is based in pescara, italy.;;;registered office;False;1992.0;;;isolamenti-srl_seac000364646-001
c.f.c. di ciarafoni fabrizio & corrado s.n.c.;construction_public_works;thermal_insulation_materials;;wholesaler;79 via palaverta | 00047 marino - italy;marino - italy;47.0;italy;sound insulation materials | thermal insulation materials | clay, expanded - products;the company c.f.c. di ciarafoni fabrizio & corrado s.n.c., is a wholesaler, founded in 2002, which operates in the sound insulation materials industry. it also operates in the thermal insulation materials, and clay, expanded - products industries. it is based in marino, italy.;1.0;10.0;registered office;False;2002.0;;;cfc-di-ciarafoni-fabrizio-corrado-snc_seac003261045-001
teknowool sud s.r.l.;construction_public_works;thermal_insulation_materials;;wholesaler;109 via imparato ferrante | 80146 napoli - italy;napoli - italy;80146.0;italy;anti-corrosion products, chemical | sound insulation materials | thermal insulation materials;the company teknowool sud s.r.l., is a wholesaler, founded in 1998, which operates in the anti-corrosion products, chemical industry. it also operates in the sound insulation materials, and thermal insulation materials industries. it is based in napoli, italy.;;;registered office;False;1998.0;http://www.teknowoolsud.it;;teknowool-sud-srl_seac003285107-001
tekal;construction_public_works;thermal_insulation_materials;;wholesaler;giusti giuseppe 49 cittadella | 35100 padova - italy;padova - italy;35100.0;italy;sound insulation materials | thermal insulation materials | clay, expanded - products;the company tekal, is a wholesaler, which operates in the sound insulation materials industry. it also operates in the thermal insulation materials, and clay, expanded - products industries. it is based in padova, italy.;;;registered office;False;;http://www.tekal.net/;;tekal_seac001546320-001
fo. g. s.r.l.;construction_public_works;thermal_insulation_materials;;service provider;850 via formica | 55100 lucca - italy;lucca - italy;55100.0;italy;sound insulation materials | thermal insulation materials | clay, expanded - products;the company fo. g. s.r.l., is a service provider, founded in 1989, which operates in the sound insulation materials industry. it also operates in the thermal insulation materials, and clay, expanded - products industries. it is based in lucca, italy.;11.0;50.0;registered office;False;1989.0;http://www.foglucca.com;;fo-g-srl_seac001862716-001
cit di bada' marco & c. s.a.s.;construction_public_works;thermal_insulation_materials;;manufacturer/ producer;1 via della repubblica | 13874 mottalciata - italy;mottalciata - italy;13874.0;italy;sound insulation materials | thermal insulation materials | clay, expanded - products;the company cit di bada' marco & c. s.a.s., is a manufacturer/ producer, founded in 1985, which operates in the sound insulation materials industry. it also operates in the thermal insulation materials, and clay, expanded - products industries. it is based in mottalciata, italy.;;;registered office;False;1985.0;http://www.paginegialle.it/citisolanti;;cit-di-bada-marco-c-sas_seac000429308-001
nuova grondex s.r.l.;construction_public_works;thermal_insulation_materials;;;3 via monteschiavo | 60030 maiolati spontini - italy;maiolati spontini - italy;60030.0;italy;sound insulation materials | thermal insulation materials | bricks;the company nuova grondex s.r.l., which operates in the sound insulation materials industry. it also operates in the thermal insulation materials, and bricks industries. it is based in maiolati spontini, italy.;11.0;50.0;;False;;;;nuova-grondex-srl_seac005762282-001
class s.r.l.;construction_public_works;thermal_insulation_materials;;;7 via firenze | 00043 ciampino - italy;ciampino - italy;43.0;italy;anti-corrosion products, chemical | sound insulation materials | thermal insulation materials;the company class s.r.l., which operates in the anti-corrosion products, chemical industry. it also operates in the sound insulation materials, and thermal insulation materials industries. it is based in ciampino, italy.;11.0;50.0;registered office;False;;;;class-srl_seac005618149-001
maestri f.lli;construction_public_works;thermal_insulation_materials;;subcontractor;2 via roma | 27010 valle salimbene - italy;valle salimbene - italy;27010.0;italy;sound insulation materials | thermal insulation materials | clay, expanded - products;the company maestri f.lli, is a subcontractor, founded in 1986, which operates in the sound insulation materials industry. it also operates in the thermal insulation materials, and clay, expanded - products industries. it is based in valle salimbene, italy.;11.0;50.0;registered office;False;1986.0;;;maestri-flli_seac000377320-001
spenglerei waldner kg;construction_public_works;thermal_insulation_materials;;manufacturer/ producer;15 via prati nuovi | 39020 marlengo - italy;marlengo - italy;39020.0;italy;anti-corrosion products, chemical | sound insulation materials | thermal insulation materials;the company spenglerei waldner kg, is a manufacturer/ producer, founded in 1993, which operates in the anti-corrosion products, chemical industry. it also operates in the sound insulation materials, and thermal insulation materials industries. it is based in marlengo, italy.;;;registered office;False;1993.0;http://www.spenglerei-waldner.it/;;spenglerei-waldner-kg_seac000432967-001
tre emme di milani adriano e c. ( s.n.c. );construction_public_works;thermal_insulation_materials;;manufacturer/ producer;7 via marinelle | 35030 saccolongo - italy;saccolongo - italy;35030.0;italy;anti-corrosion products, chemical | sound insulation materials | thermal insulation materials;the company tre emme di milani adriano e c. ( s.n.c. ), is a manufacturer/ producer, founded in 1986, which operates in the anti-corrosion products, chemical industry. it also operates in the sound insulation materials, and thermal insulation materials industries. it is based in saccolongo, italy.;11.0;50.0;registered office;False;1986.0;;;tre-emme-di-milani-adriano-e-c-snc-_seac000610899-001
salinaro andrea;construction_public_works;thermal_insulation_materials;;;3 via di porto | 50058 signa - italy;signa - italy;50058.0;italy;anti-corrosion products, chemical | sound insulation materials | thermal insulation materials;the company salinaro andrea, which operates in the anti-corrosion products, chemical industry. it also operates in the sound insulation materials, and thermal insulation materials industries. it is based in signa, italy.;;;registered office;False;;;;salinaro-andrea_seac009648711-001
vetroresina toscana;construction_public_works;thermal_insulation_materials;;manufacturer/ producer;45 via catalani alfredo | 50050 cerreto guidi - italy;cerreto guidi - italy;50050.0;italy;thermal insulation materials | storage tanks | cisterns, plastic;the company vetroresina toscana, is a manufacturer/ producer, founded in 1976, which operates in the thermal insulation materials industry. it also operates in the storage tanks, and cisterns, plastic industries. it is based in cerreto guidi, italy.;11.0;50.0;registered office;False;1976.0;http://www.vetroresinatoscana.com;;vetroresina-toscana_seac000357771-001
six italia s.p.a.;construction_public_works;thermal_insulation_materials;;service provider;1 molo giano | 16128 genova - italy;genova - italy;16128.0;italy;sound insulation materials | thermal insulation materials | clay, expanded - products;the company six italia s.p.a., is a service provider, founded in 1974, which operates in the sound insulation materials industry. it also operates in the thermal insulation materials, and clay, expanded - products industries. it is based in genova, italy.;51.0;100.0;registered office;False;1974.0;http://www.sixitalia.com;;six-italia-spa_seac002848341-001
gasket srls;construction_public_works;thermal_insulation_materials;;;strada provinciale asti quattordio | 14030 scurzolengo - italy;scurzolengo - italy;14030.0;italy;sound insulation materials | thermal insulation materials | clay, expanded - products;the company gasket srls, which operates in the sound insulation materials industry. it also operates in the thermal insulation materials, and clay, expanded - products industries. it is based in scurzolengo, italy.;;;;False;;;;gasket-srls_seac009766857-001
ata s.r.l.;construction_public_works;thermal_insulation_materials;;retailer;60 viale europa | 10024 moncalieri - italy;moncalieri - italy;10024.0;italy;sound insulation materials | thermal insulation materials | clay, expanded - products;the company ata s.r.l., is a retailer, which operates in the sound insulation materials industry. it also operates in the thermal insulation materials, and clay, expanded - products industries. it is based in moncalieri, italy.;;;;False;;http://www.paginegialle.it/atasrl_ggbegi;;ata-srl_seac005267859-001
l.p.s. di montanari alessandro & mattioli francesco s.n.c.;construction_public_works;thermal_insulation_materials;;;91 via papiria | 61032 fano - italy;fano - italy;61032.0;italy;anti-corrosion products, chemical | sound insulation materials | thermal insulation materials;the company l.p.s. di montanari alessandro & mattioli francesco s.n.c., founded in 2001, which operates in the anti-corrosion products, chemical industry. it also operates in the sound insulation materials, and thermal insulation materials industries. it is based in fano, italy.;;;registered office;False;2001.0;https://www.facebook.com/lpsfano/timeline;;lps-di-montanari-alessandro-mattioli-francesco-snc_seac000624428-001
edilsughero s.r.l.;construction_public_works;thermal_insulation_materials;;wholesaler;6 via umbria | 51010 uzzano - italy;uzzano - italy;51010.0;italy;sound insulation materials | thermal insulation materials | clay, expanded - products;the company edilsughero s.r.l., is a wholesaler, founded in 1998, which operates in the sound insulation materials industry. it also operates in the thermal insulation materials, and clay, expanded - products industries. it is based in uzzano, italy.;;;registered office;False;1998.0;http://www.edilsughero.it;;edilsughero-srl_seac000122780-001
edil isotermo s.r.l.;construction_public_works;thermal_insulation_materials;;;via villa carrara | 03039 sora - italy;sora - italy;3039.0;italy;sound insulation materials | thermal insulation materials | ceilings;the company edil isotermo s.r.l., founded in 1980, which operates in the sound insulation materials industry. it also operates in the thermal insulation materials, and ceilings industries. it is based in sora, italy.;11.0;50.0;registered office;False;1980.0;http://www.edilisotermo.it;;edil-isotermo-srl_seac000083436-001
vieffe s.r.l.;construction_public_works;thermal_insulation_materials;;wholesaler;119 via orbetello | 10148 torino - italy;torino - italy;10148.0;italy;sound insulation materials | thermal insulation materials | ceilings;the company vieffe s.r.l., is a wholesaler, founded in 1993, which operates in the sound insulation materials industry. it also operates in the thermal insulation materials, and ceilings industries. it is based in torino, italy.;11.0;50.0;registered office;False;1993.0;http://www.paginebianche.it/vieffecontrosoffitti-torino;;vieffe-srl_seac001025577-001
freudenberg politex;construction_public_works;thermal_insulation_materials;;manufacturer/ producer;pomarico | 75015 pisticci - italy;pisticci - italy;75015.0;italy;sound insulation materials | thermal insulation materials | bricks;the company freudenberg politex, is a manufacturer/ producer, founded in 1975, which operates in the sound insulation materials industry. it also operates in the thermal insulation materials, and bricks industries. it is based in pisticci, italy.;;;registered office;False;1975.0;http://www.freudenbergpolitex.com;;freudenberg-politex_139161517829827-001
evolution special parts s.r.l.;construction_public_works;thermal_insulation_materials;;manufacturer/ producer;km. 23.300 strada statale 87 | 81020 san nicola la strada - italy;san nicola la strada - italy;81020.0;italy;sound insulation materials | thermal insulation materials | clay, expanded - products;the company evolution special parts s.r.l., is a manufacturer/ producer, founded in 2007, which operates in the sound insulation materials industry. it also operates in the thermal insulation materials, and clay, expanded - products industries. it is based in san nicola la strada, italy.;11.0;50.0;;False;2007.0;;;evolution-special-parts-srl_seac002766205-001
rocchetti sergio aurelio;construction_public_works;thermal_insulation_materials;;;20 via belotti | 24018 villa d'alme' - italy;villa d'alme' - italy;24018.0;italy;anti-corrosion products, chemical | sound insulation materials | thermal insulation materials;the company rocchetti sergio aurelio, which operates in the anti-corrosion products, chemical industry. it also operates in the sound insulation materials, and thermal insulation materials industries. it is based in villa d'alme', italy.;;;registered office;False;;;;rocchetti-sergio-aurelio_seac005259492-001
edilbloc;construction_public_works;thermal_insulation_materials;;manufacturer/ producer;42 via della repubblica | 52045 foiano della chiana - italy;foiano della chiana - italy;52045.0;italy;sun protection, interior and exterior | sound insulation materials | thermal insulation materials;the company edilbloc, is a manufacturer/ producer, founded in 1961, which operates in the sun protection, interior and exterior industry. it also operates in the sound insulation materials, and thermal insulation materials industries. it is based in foiano della chiana, italy.;1.0;10.0;registered office;False;1961.0;http://www.edilbloc.it;;edilbloc_seac000020865-001
