company_name;group;sector;subsector;main_activity;address;company_city;postcode;country;products_and_services;information;min_headcount;max_headcount;type_of_building_for_registered_address;verified_by_europages;year_established;websites;download_datetime;id
artigian - 2 s.n.c. di fe' marcello & brachi andrea;construction_public_works;ceilings;;;30 via calamandrei | 53045 montepulciano - italy;montepulciano - italy;53045.0;italy;painting - contractors | facelifts for facades | false ceilings;the company artigian - 2 s.n.c. di fe' marcello & brachi andrea, founded in 1989, which operates in the painting - contractors industry. it also operates in the facelifts for facades, and false ceilings industries. it is based in montepulciano, italy.;;;registered office;False;1989.0;https://www.artigian2.it/;;artigian-2-snc-di-fe-marcello-brachi-andrea_seac005410089-001
errebi contract;construction_public_works;ceilings;;agent/ representative;via dolomiti n 73 desio mb | viale como 18 paina di giussano | 82733 desio - italy;desio - italy;82733.0;italy;shop fittings | shopfitting and installation | false ceiling assembly;the company errebi contract, is a agent/ representative, which operates in the shop fittings industry. it also operates in the shopfitting and installation, and false ceiling assembly industries. it is based in desio, italy.;;;;False;;;;errebi-contract_00000003925791-206792001
ghidini gabriele e figli s.n.c.;construction_public_works;ceilings;;;5 via casale | 43022 montechiarugolo - italy;montechiarugolo - italy;43022.0;italy;painting - contractors | decorating | false ceilings;the company ghidini gabriele e figli s.n.c., founded in 1996, which operates in the painting - contractors industry. it also operates in the decorating, and false ceilings industries. it is based in montechiarugolo, italy.;;;registered office;False;1996.0;;;ghidini-gabriele-e-figli-snc_seac000577794-001
tecnonastri s.n.c. di trevisiol mirco e simone;construction_public_works;ceilings;;subcontractor;14/e via s. marco | 31052 maserada sul piave - italy;maserada sul piave - italy;31052.0;italy;boilermaking, heavy | boilermaking, naval | metal ceilings for the building trade;the company tecnonastri s.n.c. di trevisiol mirco e simone, is a subcontractor, founded in 2000, which operates in the boilermaking, heavy industry. it also operates in the boilermaking, naval, and metal ceilings for the building trade industries. it is based in maserada sul piave, italy.;1.0;10.0;registered office;False;2000.0;;;tecnonastri-snc-di-trevisiol-mirco-e-simone_seac002855483-001
ispan;construction_public_works;ceilings;;distributor;via marze 34 | 36060 romano d'ezzelino - italy;romano d'ezzelino - italy;36060.0;italy;ceilings, suspended;the company ispan, is a distributor, which operates in the ceilings, suspended industry. it is based in romano d'ezzelino, italy.;1.0;10.0;;False;;http://www.ispan.it;;ispan_00000004010862-285704001
ditta gartu - soluzioni di interni;construction_public_works;ceilings;;;via croce 41 | 15067 novi ligure - italy;novi ligure - italy;15067.0;italy;ceilings, suspended | ceilings and false ceilings | whitewashing;the company ditta gartu - soluzioni di interni, which operates in the ceilings, suspended industry. it also operates in the ceilings and false ceilings, and whitewashing industries. it is based in novi ligure, italy.;;;;False;;http://www.dittagartu.it;;ditta-gartu-soluzioni-di-interni_00000003678263-104801001
mondo edilizia roma;construction_public_works;ceilings;;service provider;via nomentana, 994 | 00137 roma - italy;roma - italy;137.0;italy;restoration and renovation - contractors | pvc windows and frames | suspended ceiling;the company mondo edilizia roma, is a service provider, which operates in the restoration and renovation - contractors industry. it also operates in the pvc windows and frames, and suspended ceiling industries. it is based in roma, italy.;1.0;10.0;;False;;http://www.mondoediliziaroma.it;;mondo-edilizia-roma_00000004523405-327026001
al-ma;construction_public_works;ceilings;;manufacturer/ producer;6 via villaggio arnica | 23888 la valletta brianza - italy;la valletta brianza - italy;23888.0;italy;restoration and renovation - contractors | building renovation | metallic false ceilings;the company al-ma, is a manufacturer/ producer, founded in 1997, which operates in the restoration and renovation - contractors industry. it also operates in the building renovation, and metallic false ceilings industries. it is based in la valletta brianza, italy.;;;registered office;False;1997.0;;;alma_seac002493003-001
coccopitture s.n.c. di cocco tiziano & stefano;construction_public_works;ceilings;;;18 via visconti | 36033 isola vicentina - italy;isola vicentina - italy;36033.0;italy;painting - contractors | suspended ceiling | venetian stuccos;the company coccopitture s.n.c. di cocco tiziano & stefano, which operates in the painting - contractors industry. it also operates in the suspended ceiling, and venetian stuccos industries. it is based in isola vicentina, italy.;;;;False;;https://www.coccopitture.it/;;coccopitture-snc-di-cocco-tiziano-stefano_seac005693542-001
i colori dell'iride di berto matteo e marco e c. s.a.s.;construction_public_works;ceilings;;;scheo | 31032 casale sul sile - italy;casale sul sile - italy;31032.0;italy;painting - contractors | false ceilings | plasterboard false ceilings;the company i colori dell'iride di berto matteo e marco e c. s.a.s., which operates in the painting - contractors industry. it also operates in the false ceilings, and plasterboard false ceilings industries. it is based in casale sul sile, italy.;;;registered office;False;;;;i-colori-delliride-di-berto-matteo-e-marco-e-c-sas_seac004889679-001
doppiozero s.n.c.;construction_public_works;ceilings;;;cavour camillo benso | 35042 este - italy;este - italy;35042.0;italy;finishing work | painting - contractors | false ceilings;the company doppiozero s.n.c., which operates in the finishing work industry. it also operates in the painting - contractors, and false ceilings industries. it is based in este, italy.;;;;False;;;;doppiozero-snc_seac005849345-001
valbonetti claudio;construction_public_works;ceilings;;;bianco da durazzo | 47122 forli' - italy;forli' - italy;47122.0;italy;painting - contractors | false ceilings | stucco;the company valbonetti claudio, which operates in the painting - contractors industry. it also operates in the false ceilings, and stucco industries. it is based in forli', italy.;;;registered office;False;;;;valbonetti-claudio_seac004803231-001
antea 2000 sas di geom. lo monaco salvatore;construction_public_works;ceilings;;manufacturer/ producer;tasso torquato | 20091 bresso (mi) - italy;bresso (mi) - italy;20091.0;italy;ceilings, suspended;the company antea 2000 sas di geom. lo monaco salvatore, is a manufacturer/ producer, which operates in the ceilings, suspended industry. it is based in bresso (mi), italy.;1.0;10.0;;False;;;;antea-2000-sas-di-geom-lo-monaco-salvatore_sea256914842-00101
i.m.p. - imp.marchigiana pittori di capodaglio andrea & c. s.d.f.;construction_public_works;ceilings;;;20 via s. francesco d'assisi | 60025 loreto - italy;loreto - italy;60025.0;italy;painting - contractors | false ceilings | roofing waterproofing;the company i.m.p. - imp.marchigiana pittori di capodaglio andrea & c. s.d.f., which operates in the painting - contractors industry. it also operates in the false ceilings, and roofing waterproofing industries. it is based in loreto, italy.;;;;False;;;;imp-impmarchigiana-pittori-di-capodaglio-andrea-c-sdf_seac000258035-001
cogedil;construction_public_works;ceilings;;service provider;via luigi pirandello,8 | 20144 milano - italy;milano - italy;20144.0;italy;ceilings, insulated;the company cogedil, is a service provider, founded in 1981, which operates in the ceilings, insulated industry. it is based in milano, italy.;1.0;10.0;registered office;False;1981.0;http://www.cogedil.it;;cogedil_00000003513149-56076001
pohl johann & co. ohg;construction_public_works;ceilings;;;69 via centrale | 39021 laces - italy;laces - italy;39021.0;italy;painting - contractors | false ceilings | plasterboard;the company pohl johann & co. ohg, founded in 1992, which operates in the painting - contractors industry. it also operates in the false ceilings, and plasterboard industries. it is based in laces, italy.;11.0;50.0;;False;1992.0;;;pohl-johann-co-ohg_seac000421416-001
cooperativa verniciatori gia' sardi 'co.ve.sa.' soc.coop.a r.l.;construction_public_works;ceilings;;service provider;12 via fermi enrico | 47122 forli' - italy;forli' - italy;47122.0;italy;painting - contractors | false ceilings | painting of buildings;the company cooperativa verniciatori gia' sardi 'co.ve.sa.' soc.coop.a r.l., is a service provider, founded in 1946, which operates in the painting - contractors industry. it also operates in the false ceilings, and painting of buildings industries. it is based in forli', italy.;;;registered office;False;1946.0;http://www.verniciatorigiasardicovesa.it/;;cooperativa-verniciatori-gia-sardi-covesa-soccoopa-rl_seac000026024-001
flessati s.r.l.;construction_public_works;ceilings;;subcontractor;22 via bezzi bartolomeo | 38026 ossana - italy;ossana - italy;38026.0;italy;finishing work | painting - contractors | metallic false ceilings;the company flessati s.r.l., is a subcontractor, founded in 1999, which operates in the finishing work industry. it also operates in the painting - contractors, and metallic false ceilings industries. it is based in ossana, italy.;11.0;50.0;registered office;False;1999.0;;;flessati-srl_seac002080323-001
niccioli ercole di niccioli alberto;construction_public_works;ceilings;;service provider;1 via lavonchio | 28859 trontano - italy;trontano - italy;28859.0;italy;painting - contractors | building finishing work | false ceilings;the company niccioli ercole di niccioli alberto, is a service provider, founded in 2007, which operates in the painting - contractors industry. it also operates in the building finishing work, and false ceilings industries. it is based in trontano, italy.;11.0;50.0;;False;2007.0;http://www.paginegialle.it/niccioliverniciatura;;niccioli-ercole-di-niccioli-alberto_seac004661347-001
f.lli fontana finiture d'interni cartongesso;construction_public_works;ceilings;;service provider;via cadelferro, 22 | 37050 oppeano - italy;oppeano - italy;37050.0;italy;ceilings, suspended;the company f.lli fontana finiture d'interni cartongesso, is a service provider, founded in 2003, which operates in the ceilings, suspended industry. it is based in oppeano, italy.;501.0;inf;registered office;False;2003.0;http://www.fontanacartongesso.it;;flli-fontana-finiture-dinterni-cartongesso_00000003555215-66729001
color art di leoni paolo;construction_public_works;ceilings;;;118 via ludovico ariosto | 24055 cologno al serio - italy;cologno al serio - italy;24055.0;italy;painting - contractors | building renovation | false ceilings;the company color art di leoni paolo, founded in 2006, which operates in the painting - contractors industry. it also operates in the building renovation, and false ceilings industries. it is based in cologno al serio, italy.;1.0;10.0;registered office;False;2006.0;;;color-art-di-leoni-paolo_seac004631925-001
tecnoalba s.r.l.;construction_public_works;ceilings;;;16 piazza battisti cesare | 51016 montecatini terme - italy;montecatini terme - italy;51016.0;italy;weatherproofing contractors | painting - contractors | suspended ceiling;the company tecnoalba s.r.l., which operates in the weatherproofing contractors industry. it also operates in the painting - contractors, and suspended ceiling industries. it is based in montecatini terme, italy.;;;registered office;False;;http://www.tecnoalba.it;;tecnoalba-srl_seac005136548-001
greggio giuliano;construction_public_works;ceilings;;service provider;30/d via casolina | 35020 masera' di padova - italy;masera' di padova - italy;35020.0;italy;painting - contractors | false ceilings | industrial painting;the company greggio giuliano, is a service provider, founded in 1999, which operates in the painting - contractors industry. it also operates in the false ceilings, and industrial painting industries. it is based in masera' di padova, italy.;;;registered office;False;1999.0;;;greggio-giuliano_seac000874295-001
cipriani profilati s.r.l.;construction_public_works;ceilings;;manufacturer/ producer;31 via alla pineta | 38068 rovereto - italy;rovereto - italy;38068.0;italy;sections and bars - ferrous metal | profiled sheets - ferrous metal | ceilings, modular cladding;the company cipriani profilati s.r.l., is a manufacturer/ producer, founded in 2006, which operates in the sections and bars - ferrous metal industry. it also operates in the profiled sheets - ferrous metal, and ceilings, modular cladding industries. it is based in rovereto, italy.;;;registered office;False;2006.0;http://www.ciprianiprofilati.it;;cipriani-profilati-srl_seac000308709-001
urthaler ernst ( s.n.c. );construction_public_works;ceilings;;;155 s. giacomo | 39040 barbiano - italy;barbiano - italy;39040.0;italy;finishing work | painting - contractors | false ceilings;the company urthaler ernst ( s.n.c. ), which operates in the finishing work industry. it also operates in the painting - contractors, and false ceilings industries. it is based in barbiano, italy.;;;;False;;;;urthaler-ernst-snc-_seac000401569-001
tm di taras marco antonio;construction_public_works;ceilings;;service provider;via palermo, 36 | 08029 siniscola (nuora) - italy;siniscola (nuora) - italy;8029.0;italy;ceilings, suspended | floor resins | plasterboard;the company tm di taras marco antonio, is a service provider, which operates in the ceilings, suspended industry. it also operates in the floor resins, and plasterboard industries. it is based in siniscola (nuora), italy.;1.0;10.0;registered office;False;;;;tm-di-taras-marco-antonio_00000003625253-00101
canzian j. di canzian jorge antonio;construction_public_works;ceilings;;;6 via eleonora duse | 33080 prata di pordenone - italy;prata di pordenone - italy;33080.0;italy;painting - contractors | finishing work | false ceilings;the company canzian j. di canzian jorge antonio, founded in 2004, which operates in the painting - contractors industry. it also operates in the finishing work, and false ceilings industries. it is based in prata di pordenone, italy.;;;registered office;False;2004.0;;;canzian-j-di-canzian-jorge-antonio_seac005007186-001
edilcolor val.g.s;construction_public_works;ceilings;;manufacturer/ producer;cinquefrondi | c/gunnari n°4 | 89021 cinquefrondi - italy;cinquefrondi - italy;89021.0;italy;ceilings, suspended;the company edilcolor val.g.s, is a manufacturer/ producer, which operates in the ceilings, suspended industry. it is based in cinquefrondi, italy.;1.0;10.0;;False;;;;edilcolor-valgs_00000003894617-184267001
gm tinteggi s.n.c.;construction_public_works;ceilings;;service provider;84/a via vittorio emanuele ii | 42020 albinea - italy;albinea - italy;42020.0;italy;painting - contractors | finishing work | suspended ceiling;the company gm tinteggi s.n.c., is a service provider, which operates in the painting - contractors industry. it also operates in the finishing work, and suspended ceiling industries. it is based in albinea, italy.;;;registered office;False;;http://www.gmtinteggi.com;;gm-tinteggi-snc_seac005130547-001
mogliano color di massimo longo;construction_public_works;ceilings;;service provider;88 via casoni | 31021 mogliano veneto - italy;mogliano veneto - italy;31021.0;italy;painting - contractors | slaked lime | plasterboard false ceilings;the company mogliano color di massimo longo, is a service provider, founded in 1997, which operates in the painting - contractors industry. it also operates in the slaked lime, and plasterboard false ceilings industries. it is based in mogliano veneto, italy.;1.0;10.0;registered office;False;1997.0;;;mogliano-color-di-massimo-longo_seac005308774-001
grossistailluminazione;construction_public_works;ceilings;;wholesaler;via ley, 19 | 10028 trofarello - italy;trofarello - italy;10028.0;italy;lighting, domestic and accessories | lamps | ceiling fan;the company grossistailluminazione, is a wholesaler, which operates in the lighting, domestic and accessories industry. it also operates in the lamps, and ceiling fan industries. it is based in trofarello, italy.;1.0;10.0;;False;;http://www.grossistailluminazione.com;;grossistailluminazione_00000004506039-319262001
new style edil noe09 srl;construction_public_works;ceilings;;service provider;via carlo casini 191 | 00126 roma - italy;roma - italy;126.0;italy;ceilings, suspended;the company new style edil noe09 srl, is a service provider, founded in 2000, which operates in the ceilings, suspended industry. it is based in roma, italy.;1.0;10.0;;False;2000.0;;;new-style-edil-noe09-srl_00000003443139-38535001
sts isolamenti s.r.l.;construction_public_works;ceilings;;service provider;94 via valgioie | 10146 torino - italy;torino - italy;10146.0;italy;weatherproofing contractors | metal ceilings for the building trade | insulating paint;the company sts isolamenti s.r.l., is a service provider, which operates in the weatherproofing contractors industry. it also operates in the metal ceilings for the building trade, and insulating paint industries. it is based in torino, italy.;;;registered office;False;;http://www.stsisolamenti.com;;sts-isolamenti-srl_seac005066632-001
corviale 2000;construction_public_works;ceilings;;service provider;4 via vela vincenzo | 00148 roma - italy;roma - italy;148.0;italy;legal counselling | false ceiling cleaning services | office cleaning services;the company corviale 2000, is a service provider, founded in 1998, which operates in the legal counselling industry. it also operates in the false ceiling cleaning services, and office cleaning services industries. it is based in roma, italy.;;;;False;1998.0;;;corviale-2000_seac001005614-001
pagani angelo;construction_public_works;ceilings;;service provider;23 via manzoni alessandro | 24040 arcene - italy;arcene - italy;24040.0;italy;boilermaking, heavy | boilermaking, naval | metal ceilings for the building trade;the company pagani angelo, is a service provider, founded in 2001, which operates in the boilermaking, heavy industry. it also operates in the boilermaking, naval, and metal ceilings for the building trade industries. it is based in arcene, italy.;1.0;10.0;registered office;False;2001.0;;;pagani-angelo_seac000785738-001
cavallo s.r.l.;construction_public_works;ceilings;;;2 via madonie | 97100 ragusa - italy;ragusa - italy;97100.0;italy;ceilings | ceilings, suspended | ceilings, insulated;the company cavallo s.r.l., founded in 2004, which operates in the ceilings industry. it also operates in the ceilings, suspended, and ceilings, insulated industries. it is based in ragusa, italy.;;;registered office;False;2004.0;http://www.paginegialle.it/cavallo-srl-ragusa;;cavallo-srl_seac000344520-001
dras;construction_public_works;ceilings;;service provider;3 via mezzomonte | 33077 sacile - italy;sacile - italy;33077.0;italy;ceilings | sound insulation materials | thermal insulation materials;the company dras, is a service provider, founded in 1992, which operates in the ceilings industry. it also operates in the sound insulation materials, and thermal insulation materials industries. it is based in sacile, italy.;11.0;50.0;registered office;False;1992.0;https://www.drascartongessi.it/;;dras_seac004987306-001
saggin f.lli;construction_public_works;ceilings;;;63 viale europa | 17028 spotorno - italy;spotorno - italy;17028.0;italy;ceilings | structural work | construction - finishings;the company saggin f.lli, founded in 1963, which operates in the ceilings industry. it also operates in the structural work, and construction - finishings industries. it is based in spotorno, italy.;;;registered office;False;1963.0;http://www.paginebianche.it/fllisaggin-spotorno;;saggin-flli_seac000019010-001
m.t. tecnologie edili s.r.l.;construction_public_works;ceilings;;manufacturer/ producer;88 via dismano | 48124 ravenna - italy;ravenna - italy;48124.0;italy;ceilings | ceilings, suspended | ceilings, insulated;the company m.t. tecnologie edili s.r.l., is a manufacturer/ producer, founded in 2004, which operates in the ceilings industry. it also operates in the ceilings, suspended, and ceilings, insulated industries. it is based in ravenna, italy.;;;registered office;False;2004.0;;;mt-tecnologie-edili-srl_seac004807225-001
mazzeo nicola;construction_public_works;ceilings;;;biella | 10042 nichelino - italy;nichelino - italy;10042.0;italy;ceilings | ceilings, suspended | ceilings, insulated;the company mazzeo nicola, which operates in the ceilings industry. it also operates in the ceilings, suspended, and ceilings, insulated industries. it is based in nichelino, italy.;;;registered office;False;;http://www.mazzeonicola.it;;mazzeo-nicola_seac001012399-001
levi srls;construction_public_works;ceilings;;;via mattine | 84043 agropoli - italy;agropoli - italy;84043.0;italy;ceilings | ceilings, suspended | ceilings, insulated;the company levi srls, which operates in the ceilings industry. it also operates in the ceilings, suspended, and ceilings, insulated industries. it is based in agropoli, italy.;;;;False;;;;levi-srls_seac009841973-001
f.a.li.s.di d'andrea giacomo c.snc;construction_public_works;ceilings;;retailer;contrada bugiades | 92027 licata - italy;licata - italy;92027.0;italy;ceilings | partitions | plaster and plaster products;the company f.a.li.s.di d'andrea giacomo c.snc, is a retailer, founded in 1995, which operates in the ceilings industry. it also operates in the partitions, and plaster and plaster products industries. it is based in licata, italy.;;;registered office;False;1995.0;;;falisdi-dandrea-giacomo-csnc_seac000576089-001
firmitas s.r.l.;construction_public_works;ceilings;;manufacturer/ producer;15 via negri francesco | 15033 casale monferrato - italy;casale monferrato - italy;15033.0;italy;ceilings | ceilings, suspended | ceilings, insulated;the company firmitas s.r.l., is a manufacturer/ producer, which operates in the ceilings industry. it also operates in the ceilings, suspended, and ceilings, insulated industries. it is based in casale monferrato, italy.;;;registered office;False;;;;firmitas-srl_seac002072692-001
porta a porta s.r.l.;construction_public_works;ceilings;;service provider;28 via di s. quirico | 50142 firenze - italy;firenze - italy;50142.0;italy;ceilings | ceilings, suspended | ceilings, insulated;the company porta a porta s.r.l., is a service provider, which operates in the ceilings industry. it also operates in the ceilings, suspended, and ceilings, insulated industries. it is based in firenze, italy.;11.0;50.0;;False;;;;porta-a-porta-srl_seac006059383-001
sidea s.r.l.;construction_public_works;ceilings;;;9/11 via maestri del lavoro | 37059 zevio - italy;zevio - italy;37059.0;italy;ceilings | finishing work | ceilings, suspended;the company sidea s.r.l., founded in 2005, which operates in the ceilings industry. it also operates in the finishing work, and ceilings, suspended industries. it is based in zevio, italy.;11.0;50.0;registered office;False;2005.0;;;sidea-srl_seac005059003-001
f.p. di peluso francesco;construction_public_works;ceilings;;;3 via mazzacavallo | 41043 formigine - italy;formigine - italy;41043.0;italy;ceilings | ceilings, suspended | ceilings, insulated;the company f.p. di peluso francesco, which operates in the ceilings industry. it also operates in the ceilings, suspended, and ceilings, insulated industries. it is based in formigine, italy.;;;registered office;False;;;;fp-di-peluso-francesco_seac010765295-001
des s.r.l.;construction_public_works;ceilings;;service provider;3 via monte cimone | 37057 san giovanni lupatoto - italy;san giovanni lupatoto - italy;37057.0;italy;ceilings | fire protection equipment | sound insulation materials;the company des s.r.l., is a service provider, founded in 2000, which operates in the ceilings industry. it also operates in the fire protection equipment, and sound insulation materials industries. it is based in san giovanni lupatoto, italy.;;;registered office;False;2000.0;;;des-srl_seac000827197-001
sa.ma. isolanti s.r.l.;construction_public_works;ceilings;;wholesaler;km. 7.060 via nettunense | 00072 ariccia - italy;ariccia - italy;72.0;italy;sound insulation materials | thermal insulation materials | ceilings;the company sa.ma. isolanti s.r.l., is a wholesaler, founded in 1989, which operates in the sound insulation materials industry. it also operates in the thermal insulation materials, and ceilings industries. it is based in ariccia, italy.;;;registered office;False;1989.0;;;sama-isolanti-srl_seac000562591-001
baumgartner johann;construction_public_works;ceilings;;;31 hofstatt | 39040 villandro - italy;villandro - italy;39040.0;italy;ceilings | painting - contractors | ceilings, suspended;the company baumgartner johann, founded in 1986, which operates in the ceilings industry. it also operates in the painting - contractors, and ceilings, suspended industries. it is based in villandro, italy.;11.0;50.0;registered office;False;1986.0;;;baumgartner-johann_seac000322528-001
centro soffitti di daltri fiammetta & c. s.a.s.;construction_public_works;ceilings;;;34 via boccaccio | 47853 coriano - italy;coriano - italy;47853.0;italy;ceilings | ceilings, suspended | ceilings, insulated;the company centro soffitti di daltri fiammetta & c. s.a.s., which operates in the ceilings industry. it also operates in the ceilings, suspended, and ceilings, insulated industries. it is based in coriano, italy.;;;registered office;False;;;;centro-soffitti-di-daltri-fiammetta-c-sas_seac002775851-001
