company_name;group;sector;subsector;main_activity;address;company_city;postcode;country;products_and_services;information;min_headcount;max_headcount;type_of_building_for_registered_address;verified_by_europages;year_established;websites;download_datetime;id
g.m.c. isolamenti;construction_public_works;sound_insulation_materials;;service provider;31/a via sella quintino | 43126 parma - italy;parma - italy;43126.0;italy;sound insulation materials | thermal insulation materials | roofing materials;the company g.m.c. isolamenti, is a service provider, founded in 1988, which operates in the sound insulation materials industry. it also operates in the thermal insulation materials, and roofing materials industries. it is based in parma, italy.;11.0;50.0;registered office;False;1988.0;;;gmc-isolamenti_seac000482180-001
g.t. silenziatori industriali s.r.l.;construction_public_works;sound_insulation_materials;;manufacturer/ producer;14 via modena | 40019 sant'agata bolognese - italy;sant'agata bolognese - italy;40019.0;italy;sound insulation materials | sound frequency analysers | workplace noise suppression systems;the company g.t. silenziatori industriali s.r.l., is a manufacturer/ producer, founded in 1980, which operates in the sound insulation materials industry. it also operates in the sound frequency analysers, and workplace noise suppression systems industries. it is based in sant'agata bolognese, italy.;11.0;50.0;registered office;False;1980.0;;;gt-silenziatori-industriali-srl_seac001450792-001
facchini giuseppe & c. s.n.c.;construction_public_works;sound_insulation_materials;;;7 via cappelle | 39040 salorno sulla strada del vino - italy;salorno sulla strada del vino - italy;39040.0;italy;framework, wood | anti-corrosion products, chemical | sound insulation materials;the company facchini giuseppe & c. s.n.c., founded in 1975, which operates in the framework, wood industry. it also operates in the anti-corrosion products, chemical, and sound insulation materials industries. it is based in salorno sulla strada del vino, italy.;;;registered office;False;1975.0;;;facchini-giuseppe-c-snc_seac000060603-001
comaco italiana s.p.a.;construction_public_works;sound_insulation_materials;;manufacturer/ producer;1 via fiume ronco | 47100 forli' - italy;forli' - italy;47100.0;italy;sound insulation materials | thermal insulation materials | clay, expanded - products;the company comaco italiana s.p.a., is a manufacturer/ producer, which operates in the sound insulation materials industry. it also operates in the thermal insulation materials, and clay, expanded - products industries. it is based in forli', italy.;11.0;50.0;registered office;False;;;;comaco-italiana-spa_seac005197363-001
a.f.l. s.r.l.;construction_public_works;sound_insulation_materials;;manufacturer/ producer;23 via noe' francesco | 20080 bubbiano - italy;bubbiano - italy;20080.0;italy;sound insulation materials | machine silencers | machine mufflers;the company a.f.l. s.r.l., is a manufacturer/ producer, founded in 1996, which operates in the sound insulation materials industry. it also operates in the machine silencers, and machine mufflers industries. it is based in bubbiano, italy.;;;registered office;False;1996.0;;;afl-srl_seac004767508-001
tortalla isolanti s.r.l.;construction_public_works;sound_insulation_materials;;wholesaler;25 via leonardo da vinci | 10095 grugliasco - italy;grugliasco - italy;10095.0;italy;sound insulation materials | thermal insulation materials | ceilings;the company tortalla isolanti s.r.l., is a wholesaler, founded in 1993, which operates in the sound insulation materials industry. it also operates in the thermal insulation materials, and ceilings industries. it is based in grugliasco, italy.;11.0;50.0;registered office;False;1993.0;;;tortalla-isolanti-srl_seac001025274-001
isobit s.r.l.;construction_public_works;sound_insulation_materials;;wholesaler;68/e via macchia san luca | 85100 potenza - italy;potenza - italy;85100.0;italy;sound insulation materials | paints and varnishes | parquet floors;the company isobit s.r.l., is a wholesaler, founded in 1988, which operates in the sound insulation materials industry. it also operates in the paints and varnishes, and parquet floors industries. it is based in potenza, italy.;11.0;50.0;registered office;False;1988.0;;;isobit-srl_seac000242478-001
cbf s.r.l.;construction_public_works;sound_insulation_materials;;manufacturer/ producer;88 via cassala | 25126 brescia - italy;brescia - italy;25126.0;italy;environment - services | sound insulation materials | thermal insulation materials;the company cbf s.r.l., is a manufacturer/ producer, founded in 1981, which operates in the environment - services industry. it also operates in the sound insulation materials, and thermal insulation materials industries. it is based in brescia, italy.;11.0;50.0;registered office;False;1981.0;;;cbf-srl_seac000469563-001
isoltech;construction_public_works;sound_insulation_materials;;manufacturer/ producer;26 via berlino | 24040 verdellino - italy;verdellino - italy;24040.0;italy;anti-corrosion products, chemical | sound insulation materials | thermal insulation materials;the company isoltech, is a manufacturer/ producer, founded in 1987, which operates in the anti-corrosion products, chemical industry. it also operates in the sound insulation materials, and thermal insulation materials industries. it is based in verdellino, italy.;11.0;50.0;registered office;False;1987.0;;;isoltech_seac000535894-001
baldoni s.n.c. di baldoni samuele & raffaele;construction_public_works;sound_insulation_materials;;service provider;3 via dei gladioli | 62019 recanati - italy;recanati - italy;62019.0;italy;raw materials for construction and public works | sound insulation materials | thermal insulation materials;the company baldoni s.n.c. di baldoni samuele & raffaele, is a service provider, which operates in the raw materials for construction and public works industry. it also operates in the sound insulation materials, and thermal insulation materials industries. it is based in recanati, italy.;;;registered office;False;;;;baldoni-snc-di-baldoni-samuele-raffaele_seac001992073-001
apuana coibentazioni srl;construction_public_works;sound_insulation_materials;;service provider;via pellegrino rossi | 54100 massacarrara - italy;massacarrara - italy;54100.0;italy;sound insulation materials;the company apuana coibentazioni srl, is a service provider, which operates in the sound insulation materials industry. it is based in massacarrara, italy.;1.0;10.0;;False;;;;apuana-coibentazioni-srl_00000004712968-510493001
chiarlo giulio;construction_public_works;sound_insulation_materials;;;1/1a via delle cappuccine | 16128 genova - italy;genova - italy;16128.0;italy;consultants - construction and civil engineering | sound insulation materials | quality control and certification;the company chiarlo giulio, which operates in the consultants - construction and civil engineering industry. it also operates in the sound insulation materials, and quality control and certification industries. it is based in genova, italy.;;;;False;;;;chiarlo-giulio_seac002837153-001
edilsolai;construction_public_works;sound_insulation_materials;;wholesaler;via mottola | 74015 martina franca - italy;martina franca - italy;74015.0;italy;construction materials | sound insulation materials | thermal insulation materials;the company edilsolai, is a wholesaler, founded in 1977, which operates in the construction materials industry. it also operates in the sound insulation materials, and thermal insulation materials industries. it is based in martina franca, italy.;;;registered office;False;1977.0;https://www.edilsolai.net/;;edilsolai_seac001303652-001
tecnoacustica s.r.l.;construction_public_works;sound_insulation_materials;;manufacturer/ producer;153 via piero camporesi | 47034 forlimpopoli - italy;forlimpopoli - italy;47034.0;italy;sound insulation materials | sound absorbing panelling;the company tecnoacustica s.r.l., is a manufacturer/ producer, founded in 1995, which operates in the sound insulation materials industry. it also operates in the sound absorbing panelling industries. it is based in forlimpopoli, italy.;;;;False;1995.0;http://www.tecnoacustica.it;;tecnoacustica-srl_seac002503946-001
basic & co. s.r.l.;construction_public_works;sound_insulation_materials;;;10 via ai pini | 36034 malo - italy;malo - italy;36034.0;italy;sound insulation materials | thermal insulation materials | clay, expanded - products;the company basic & co. s.r.l., which operates in the sound insulation materials industry. it also operates in the thermal insulation materials, and clay, expanded - products industries. it is based in malo, italy.;11.0;50.0;registered office;False;;;;basic-co-srl_seac005757277-001
le tre vu s.r.l.;construction_public_works;sound_insulation_materials;;;35/37 via degli scavi | 47122 forli' - italy;forli' - italy;47122.0;italy;tubes and pipes, rubber and plastic | sheet metal & tubes | sound insulation materials;the company le tre vu s.r.l., founded in 2006, which operates in the tubes and pipes, rubber and plastic industry. it also operates in the sheet metal & tubes, and sound insulation materials industries. it is based in forli', italy.;11.0;50.0;registered office;False;2006.0;http://www.letrevu.it;;le-tre-vu-srl_seac000891705-001
m.a.p. s.p.a.;construction_public_works;sound_insulation_materials;;manufacturer/ producer;15 via colombo cristoforo | 24046 osio sotto - italy;osio sotto - italy;24046.0;italy;sound insulation materials | thermal insulation materials | clay, expanded - products;the company m.a.p. s.p.a., is a manufacturer/ producer, founded in 1937, which operates in the sound insulation materials industry. it also operates in the thermal insulation materials, and clay, expanded - products industries. it is based in osio sotto, italy.;;;registered office;False;1937.0;https://www.mapspa.eu/;;map-spa_seac000088950-001
gallo isolamenti di gallo carmine;construction_public_works;sound_insulation_materials;;;1 via de gasperi | 21044 cavaria con premezzo - italy;cavaria con premezzo - italy;21044.0;italy;sound insulation materials | ceilings | roofing materials;the company gallo isolamenti di gallo carmine, founded in 2007, which operates in the sound insulation materials industry. it also operates in the ceilings, and roofing materials industries. it is based in cavaria con premezzo, italy.;;;;False;2007.0;https://www.galloisolamenti.it/;;gallo-isolamenti-di-gallo-carmine_seac000695027-001
siartec alsa srls;construction_public_works;sound_insulation_materials;;;37 via dell' industria | 64018 tortoreto - italy;tortoreto - italy;64018.0;italy;sound insulation materials;the company siartec alsa srls, which operates in the sound insulation materials industry. it is based in tortoreto, italy.;1.0;10.0;;False;;;;siartec-alsa-srls_seac006602240-001
colorificio mp s.r.l.;construction_public_works;sound_insulation_materials;;manufacturer/ producer;27 via grandi achille | 47922 rimini - italy;rimini - italy;47922.0;italy;paints and varnishes | sound insulation materials | thermal insulation materials;the company colorificio mp s.r.l., is a manufacturer/ producer, founded in 1985, which operates in the paints and varnishes industry. it also operates in the sound insulation materials, and thermal insulation materials industries. it is based in rimini, italy.;11.0;50.0;;False;1985.0;http://www.colorificiomp.it;;colorificio-mp-srl_seac000480426-001
pisapia giuseppe;construction_public_works;sound_insulation_materials;;;366/bis via vittorio veneto | 84013 cava de' tirreni - italy;cava de' tirreni - italy;84013.0;italy;coatings, putties and sealing products | sound insulation materials | thermal insulation materials;the company pisapia giuseppe, founded in 1990, which operates in the coatings, putties and sealing products industry. it also operates in the sound insulation materials, and thermal insulation materials industries. it is based in cava de' tirreni, italy.;;;registered office;False;1990.0;http://www.tecnohabit.it;;pisapia-giuseppe_seac000776487-001
sicilgesso s.p.a.;construction_public_works;sound_insulation_materials;;manufacturer/ producer;km. 335 contrada fegotto | 91011 alcamo - italy;alcamo - italy;91011.0;italy;plaster and plaster products | sound insulation materials | thermal insulation materials;the company sicilgesso s.p.a., is a manufacturer/ producer, founded in 1963, which operates in the plaster and plaster products industry. it also operates in the sound insulation materials, and thermal insulation materials industries. it is based in alcamo, italy.;11.0;50.0;registered office;False;1963.0;http://www.sicilgesso.it;;sicilgesso-spa_seac000009801-001
p.a.l.l. s.r.l.;construction_public_works;sound_insulation_materials;;service provider;35/a via tito maresciallo | 42020 quattro castella - italy;quattro castella - italy;42020.0;italy;pipes and tubes - non-ferrous metal | industrial piping | sound insulation materials;the company p.a.l.l. s.r.l., is a service provider, founded in 1986, which operates in the pipes and tubes - non-ferrous metal industry. it also operates in the industrial piping, and sound insulation materials industries. it is based in quattro castella, italy.;11.0;50.0;registered office;False;1986.0;;;pall-srl_seac000343059-001
laterlite s.p.a.;construction_public_works;sound_insulation_materials;;manufacturer/ producer;3 via correggio | 20149 milano - italy;milano - italy;20149.0;italy;anti-corrosion products, chemical | sound insulation materials | thermal insulation materials;the company laterlite s.p.a., is a manufacturer/ producer, founded in 2001, which operates in the anti-corrosion products, chemical industry. it also operates in the sound insulation materials, and thermal insulation materials industries. it is based in milano, italy.;;;;False;2001.0;http://www.leca.it;;laterlite-spa_seac002413877-001
iso-mar;construction_public_works;sound_insulation_materials;;wholesaler;5 contrada piccoli | 72100 brindisi - italy;brindisi - italy;72100.0;italy;sound insulation materials | thermal insulation materials | clay, expanded - products;the company iso-mar, is a wholesaler, founded in 1983, which operates in the sound insulation materials industry. it also operates in the thermal insulation materials, and clay, expanded - products industries. it is based in brindisi, italy.;;;registered office;False;1983.0;http://web.tiscalinet.it/isomar;;isomar_seac001481794-001
m.e.c.a. s.r.l.;construction_public_works;sound_insulation_materials;;wholesaler;56 via patrioti | 36012 asiago - italy;asiago - italy;36012.0;italy;construction materials | houseware, metal | sound insulation materials;the company m.e.c.a. s.r.l., is a wholesaler, founded in 1973, which operates in the construction materials industry. it also operates in the houseware, metal, and sound insulation materials industries. it is based in asiago, italy.;;;registered office;False;1973.0;;;meca-srl_seac000051392-001
na.ma. s.r.l.;construction_public_works;sound_insulation_materials;;wholesaler;116/a via strada regionale 443 | 45010 villadose - italy;villadose - italy;45010.0;italy;anti-corrosion products, chemical | sound insulation materials | thermal insulation materials;the company na.ma. s.r.l., is a wholesaler, founded in 1976, which operates in the anti-corrosion products, chemical industry. it also operates in the sound insulation materials, and thermal insulation materials industries. it is based in villadose, italy.;;;registered office;False;1976.0;;;nama-srl_seac000046042-001
n.d.s.;construction_public_works;sound_insulation_materials;;service provider;edison | 20088 gudo visconti - italy;gudo visconti - italy;20088.0;italy;sound insulation materials | soundproofed machine cabins and cowlings | sound absorbing panelling;the company n.d.s., is a service provider, founded in 2001, which operates in the sound insulation materials industry. it also operates in the soundproofed machine cabins and cowlings, and sound absorbing panelling industries. it is based in gudo visconti, italy.;11.0;50.0;registered office;False;2001.0;;;nds_seac002808324-001
work italia s.r.l.;construction_public_works;sound_insulation_materials;;manufacturer/ producer;24 via keplero giovanni | 20019 settimo milanese - italy;settimo milanese - italy;20019.0;italy;anti-corrosion products, chemical | sound insulation materials | thermal insulation materials;the company work italia s.r.l., is a manufacturer/ producer, founded in 1986, which operates in the anti-corrosion products, chemical industry. it also operates in the sound insulation materials, and thermal insulation materials industries. it is based in settimo milanese, italy.;;;registered office;False;1986.0;http://www.workitalia.it;;work-italia-srl_seac003350154-001
lci s.r.l.;construction_public_works;sound_insulation_materials;;service provider;3 via friuli | 30034 mira - italy;mira - italy;30034.0;italy;anti-corrosion products, chemical | sound insulation materials | thermal insulation materials;the company lci s.r.l., is a service provider, founded in 1993, which operates in the anti-corrosion products, chemical industry. it also operates in the sound insulation materials, and thermal insulation materials industries. it is based in mira, italy.;11.0;50.0;registered office;False;1993.0;http://www.lci.it;;lci-srl_seac000775083-001
l'idea ( s.r.l. );construction_public_works;sound_insulation_materials;;;20 via i maggio | 60131 ancona - italy;ancona - italy;60131.0;italy;plastic floor coverings | sound insulation materials | thermal insulation materials;the company l'idea ( s.r.l. ), founded in 1986, which operates in the plastic floor coverings industry. it also operates in the sound insulation materials, and thermal insulation materials industries. it is based in ancona, italy.;11.0;50.0;registered office;False;1986.0;;;lidea-srl-_seac000250258-001
isotecna;construction_public_works;sound_insulation_materials;;manufacturer/ producer;17 via provinciale est | 31040 salgareda - italy;salgareda - italy;31040.0;italy;sound insulation materials | thermal insulation materials | clay, expanded - products;the company isotecna, is a manufacturer/ producer, founded in 1991, which operates in the sound insulation materials industry. it also operates in the thermal insulation materials, and clay, expanded - products industries. it is based in salgareda, italy.;;;registered office;False;1991.0;http://www.isotecna.com/;;isotecna_seac002479261-001
vipres s.r.l.;construction_public_works;sound_insulation_materials;;manufacturer/ producer;via pizzamiglio | 33040 visco - italy;visco - italy;33040.0;italy;sound insulation materials | thermal insulation materials | ceilings;the company vipres s.r.l., is a manufacturer/ producer, founded in 2003, which operates in the sound insulation materials industry. it also operates in the thermal insulation materials, and ceilings industries. it is based in visco, italy.;1.0;10.0;;False;2003.0;;;vipres-srl_seac000699017-001
emmeci di porporino s.n.c.;construction_public_works;sound_insulation_materials;;;10 via borsi giosue' | 10143 torino - italy;torino - italy;10143.0;italy;anti-corrosion products, chemical | sound insulation materials | thermal insulation materials;the company emmeci di porporino s.n.c., founded in 1986, which operates in the anti-corrosion products, chemical industry. it also operates in the sound insulation materials, and thermal insulation materials industries. it is based in torino, italy.;;;registered office;False;1986.0;http://www.paginebianche.it/emmeci-torino;;emmeci-di-porporino-snc_seac000982872-001
edil.dea s.n.c.;construction_public_works;sound_insulation_materials;;;sella quintino | 09121 cagliari - italy;cagliari - italy;9121.0;italy;finishing work | anti-corrosion products, chemical | sound insulation materials;the company edil.dea s.n.c., which operates in the finishing work industry. it also operates in the anti-corrosion products, chemical, and sound insulation materials industries. it is based in cagliari, italy.;;;registered office;False;;;;edildea-snc_seac004705591-001
bustreo s.n.c.;construction_public_works;sound_insulation_materials;;service provider;41 strada s. raffaele cimena | 10090 castagneto po - italy;castagneto po - italy;10090.0;italy;ceilings | sound insulation materials | lighting, street, industrial and commercial;the company bustreo s.n.c., is a service provider, founded in 1986, which operates in the ceilings industry. it also operates in the sound insulation materials, and lighting, street, industrial and commercial industries. it is based in castagneto po, italy.;1.0;10.0;registered office;False;1986.0;;;bustreo-snc_seac000980833-001
termotetto;construction_public_works;sound_insulation_materials;;wholesaler;8 via s. tommaso d'aquino | 21100 varese - italy;varese - italy;21100.0;italy;sound insulation materials | thermal insulation materials | clay, expanded - products;the company termotetto, is a wholesaler, founded in 1976, which operates in the sound insulation materials industry. it also operates in the thermal insulation materials, and clay, expanded - products industries. it is based in varese, italy.;1.0;10.0;registered office;False;1976.0;;;termotetto_seac000105790-001
molta s.r.l.;construction_public_works;sound_insulation_materials;;service provider;laghetto di varna | 39040 varna - italy;varna - italy;39040.0;italy;floors, industrial | sound insulation materials | thermal insulation materials;the company molta s.r.l., is a service provider, which operates in the floors, industrial industry. it also operates in the sound insulation materials, and thermal insulation materials industries. it is based in varna, italy.;;;registered office;False;;;;molta-srl_seac000439239-001
fibrotermica s.p.a.;construction_public_works;sound_insulation_materials;;distributor;58/a via sauro nazario | 42021 bibbiano - italy;bibbiano - italy;42021.0;italy;sound insulation materials | thermal insulation materials | clay, expanded - products;the company fibrotermica s.p.a., is a distributor, founded in 1994, which operates in the sound insulation materials industry. it also operates in the thermal insulation materials, and clay, expanded - products industries. it is based in bibbiano, italy.;;;;False;1994.0;http://www.fibrotermica.com;;fibrotermica-spa_seac000464249-001
studio associato t & c di torchia e caramelli;construction_public_works;sound_insulation_materials;;;4 via bovio | 58022 follonica - italy;follonica - italy;58022.0;italy;quality control and certification | sound insulation materials | quality - certification;the company studio associato t & c di torchia e caramelli, which operates in the quality control and certification industry. it also operates in the sound insulation materials, and quality - certification industries. it is based in follonica, italy.;;;registered office;False;;;;studio-associato-t-c-di-torchia-e-caramelli_seac005253852-001
il boscaiolo s.a.s. di migliore fabio & c.;construction_public_works;sound_insulation_materials;;;7/a via mangiacane | 12011 borgo san dalmazzo - italy;borgo san dalmazzo - italy;12011.0;italy;anti-corrosion products, chemical | framework, wood | sound insulation materials;the company il boscaiolo s.a.s. di migliore fabio & c., founded in 2002, which operates in the anti-corrosion products, chemical industry. it also operates in the framework, wood, and sound insulation materials industries. it is based in borgo san dalmazzo, italy.;;;registered office;False;2002.0;http://www.paginegialle.it/ilboscaiolosas_lgddbd;;il-boscaiolo-sas-di-migliore-fabio-c_seac000810230-001
balconi giannino ( s.r.l. );construction_public_works;sound_insulation_materials;;manufacturer/ producer;48/b via sempione | 21029 vergiate - italy;vergiate - italy;21029.0;italy;framework, wood | sound insulation materials | thermal insulation materials;the company balconi giannino ( s.r.l. ), is a manufacturer/ producer, founded in 1991, which operates in the framework, wood industry. it also operates in the sound insulation materials, and thermal insulation materials industries. it is based in vergiate, italy.;11.0;50.0;registered office;False;1991.0;https://www.segheriabalconi.com/;;balconi-giannino-srl-_seac000584596-001
ve.co s.r.l.;construction_public_works;sound_insulation_materials;;;6/1 via s. martino | 15028 quattordio - italy;quattordio - italy;15028.0;italy;anti-corrosion products, chemical | sound insulation materials | thermal insulation materials;the company ve.co s.r.l., founded in 1977, which operates in the anti-corrosion products, chemical industry. it also operates in the sound insulation materials, and thermal insulation materials industries. it is based in quattordio, italy.;11.0;50.0;registered office;False;1977.0;http://www.vecosrl.it;;veco-srl_seac000109837-001
di gregorio santo;construction_public_works;sound_insulation_materials;;;garibaldi | 95011 calatabiano - italy;calatabiano - italy;95011.0;italy;industrial consultants | fire protection equipment | sound insulation materials;the company di gregorio santo, which operates in the industrial consultants industry. it also operates in the fire protection equipment, and sound insulation materials industries. it is based in calatabiano, italy.;;;registered office;False;;;;di-gregorio-santo_seac000688145-001
