company_name;group;sector;subsector;main_activity;address;company_city;postcode;country;products_and_services;information;min_headcount;max_headcount;type_of_building_for_registered_address;verified_by_europages;year_established;websites;download_datetime;id
antonino caudullo srl;agriculture_livestock;dried_fruits;;manufacturer/ producer;viale regina margherita 132 | 95034 bronte - italy;bronte - italy;95034.0;italy;dried fruits | fruit export | items for ice cream parlours | dried fruit | pistachio flakes | almond processing | semi-finished products | shelled almonds | shelled almonds | pistachios;the finest local produce in all its forms: pistachios in the shell, shelled or peeled, flakes, flour or paste. outstanding raw materials obtained using procedures that deliver total transparency in terms of the product's processing, quality and origin. family caudullo has been processing and trading nuts since the fifties 50. especially the pistachios that are produced in the bronte area.;;;registered office – parent company;True;;http://www.antoninocaudullo.com;;antonino-caudullo-srl_seac000932606-001
befer fruit srl;agriculture_livestock;dried_fruits;;wholesaler;via canali, 16 | 40127 bologna - italy;bologna - italy;40127.0;italy;vegetables, edible roots and tubers | fruit | import of fruit | import of vegetables | fruit importers | fruit and vegetable wholesaler | wholesale of fruit | fruit & vegetables | wholesale of vegetables | dried fruit;import and export of fruit and vegetables befer fruit srl in bologna has, since 1980, been working as a fruit and vegetable wholesaler whose head office is situated at the bologna agri-business centre, the caab, and has over 30 years' experience in this sector. every day, great care and attention is paid to the produce purchased directly from the place of production to ensure maximum freshness and quality. befer fruit supplies wholesalers, small and medium-scale distribution outlets throughout italy. also, import of stocks from abroad possible by special order.;;;registered office – parent company;True;1980.0;http://www.beferfruitbologna.eu;;befer-fruit-srl_seac002399613-001
la casareccia;agriculture_livestock;dried_fruits;;distributor;via stabia, 438 | 80057 sant'antonio abate - italy;sant'antonio abate - italy;80057.0;italy;tinned foods | vegetables, preserved | dried fruits | canned pulses | canned vegetables | canned tomatoes | canning industry supplies | vegetables | trifolati mushrooms | packaged lentils;la casareccia, with registered office in via stabia, sant'antonio abate (na), italy, is a company that preserves food, from tomatoes to legumes, vegetables selected and packaged with the utmost care. the company meets the required uni en iso 9001 – accredia – cermet – brc food certification standards.;;;registered office;True;;https://lacasareccia.it/;;la-casareccia_seac001805421-001
agri cereal mandorle;agriculture_livestock;dried_fruits;;wholesaler;contrada mariano snc | 93016 riesi - italy;riesi - italy;93016.0;italy;fruits, dried | almond processing | wholesale almonds | agri cereal mandorle | almonds | almonds from sicily | dried fruit | supply of almonds | shelled almonds | sale of almonds;the almond used by bakers and confectioners to make nougat, biscuits, marzipan, almond milk, ice-creams and granitas. an unquestioned pastry item that has countless applications for all sweet and savoury food solutions. agri cereal mandorle is one of the best known companies in sicily in regards to trading and processing high quality standard and organic almonds. this thanks to the innovative technological equipment it uses.;;;registered office;True;1974.0;http://www.agricerealmandorle.com;;agri-cereal-mandorle_seac004661449-001
gi e gi di v. giuffrida;agriculture_livestock;dried_fruits;;wholesaler;via tripoli 85 | 95040 camporotondo etneo - italy;camporotondo etneo - italy;95040.0;italy;dried fruits | packed pistachios | dried mushrooms | packed pine nuts | spices | cherries | tinned capers | legumes;the company gi e gi di vincenzo giuffrida is specialised in trading spices, dried mushrooms, natural flavourings, beans, nuts, candied fruit, capers. ever since it started, the company has been typically a craft-type business. the production cycle is based on the best types of dried mushrooms, natural flavourings, beans, nuts, candied fruit that are carefully selected every day according to their quality and origin.;1.0;10.0;registered office – parent company;True;;https://www.giegispezie.it/;;gi-e-gi-di-v-giuffrida_seac000911383-001
oltresole srl;agriculture_livestock;dried_fruits;;distributor;via carlo zotti 20 | 47122 forlì - italy;forlì - italy;47122.0;italy;food - import-export | organic farming | dried fruit | toasted dry fruits | supplies for restaurants;the company oltresole srl, is a distributor, which operates in the food - import-export industry. it also operates in the organic farming, dried fruit, toasted dry fruits, and supplies for restaurants industries. it is based in forlì, italy.;1.0;10.0;registered office;True;;https://www.oltresole.com/;;oltresole-srl_seac010022521-001
ekoterra food srl;agriculture_livestock;dried_fruits;;multi-category;turin | 10153 turin - italy;turin - italy;10153.0;italy;freeze-dried fruit | organic tomato paste | organic fruit vegetable powder | organic semi dried tomato | fruit juice concentrates;since 2002, ekoterra food ingredients offers all-natural and organic food ingredients from turkey, italy and other eu countries for the best quality and price target. based in turin, italy we work b2b in bulk, either directly from producer delivery to buyer, or import in eu and distribute within eu. we directly represent producers who work with fruits and vegetables grown in contracted farms or on their own lands. we shorten the supply chain with elevated quality and best possible price.our focus is to serve companies with transparent, traceable and certified quality guarantees with best logistic solutions. we supply air-dried, freeze-dried fruit pieces, fruit powders(apple, banana, peach, kiwi, watermelon, goji berry, pomegranate, apricot, figs, sultana, mandarin, melon, orange, pear, persimmon, plum, raspberry, sour cherry), vegetable pieces, vegetable powders(tomato, spinach, beetroot, carrots, black carrots), herbs and spices (oregano, thyme, cumin, anise, fennel, rosemary, sage), conventional and organic fruit juice from concentrates and nfc(apple, apricot, pomegranate, carrot, sour cherry, lemon, orange, peach, pear, black carrot, red beet), nfc fruit juices, sun dried apricots, figs, hazelnuts(kernels, meals and pastes), pistachios, lentils, chickpeas, superfood ingredients, plant based proteins and tomato pastes. we are constantly expanding our organic ingredient offerings that are offered directly from organic growers and manufacturers in turkey, italy and eu.;1.0;10.0;registered office;False;2002.0;https://www.ekoterrafood.com;;ekoterra-food-srl_00000005431616-770174001
bio nocciola;agriculture_livestock;dried_fruits;;manufacturer/ producer;zona industriale strada massarella loc. capannelle snc | 01030 carbognano - italy;carbognano - italy;1030.0;italy;dried fruits | hazelnuts | hazelnut grain paste flour | packaged hazelnuts | whole and shelled hazelnuts;our heart beats only for a product and today we position ourselves in the first places in the world market for the quality and excellence of our hazelnuts and its semi-finished products. we sell hazelnuts mainly sourced locally (lazio) but also from several other italian regions and around the world such as turkey georgia azerbaijan. our hazelnuts products are: natural whole kernels, roasted kernels, roasted grain, roasted flour and 100% hazelnut paste. our product is aimed mainly to the food industry, confectionery and small artisan businesses for fresh consumption. we can provide a product that is tailored to our clients requests. our strength finds its roots in our history, in the experience accumulated over six decades. experience that goes from cultivation to process a jewel of our lands, the hazelnut.;11.0;50.0;registered office;False;1999.0;http://www.bionocciola.it;;bio-nocciola_00000005305503-611720001
spitaleri s.r.l.;agriculture_livestock;dried_fruits;;manufacturer/ producer;c/da sciarotta | 95034 bronte - italy;bronte - italy;95034.0;italy;dried fruits | crushed pistachios | packed pistachios | semi-finished products for ice cream bars | packaged hazelnuts;~presenti nel territorio di bronte, famoso per il suo pistacchio verde di bronte dop, la spitaleri s.r.l. ha iniziato la sua attività con la sgusciatura dell'oro verde, con annessa lavorazione e commercializzazione di pistacchio, mandorle e nocciole locale. dopo anni di attenta selezione importiamo le migliori varietà estere di frutta secca nel pieno rispetto dei nostri standard qualitativi, garantendo prodotti con prezzi e qualità vantaggiose. di recente la creazione del marchio exedis nato dall'idea di offrire ai nostri clienti un prodotto ricercato e di qualità. ci ispiriamo al principio che chiunque prepari una pietanza sappia scegliere i migliori ingredienti per far gustare con piacere ciò che si mangia; per questo il marchio si rivolge principalmente ad addetti del settore, che sanno manipolare con cura le materie prime creando il piatto finito, sia esso dolce che salato. riforniamo pasticcerie, gelaterie, aziende che operano nella trasformazione, nella ristorazione, ed operatori all'ingrosso del settore, garantendo un servizio personalizzato e un prodotto di altissima qualità.~;1.0;10.0;registered office – parent company - subsidiary;False;2012.0;https://www.pistacchioenonsolo.it/;;spitaleri-srl_seac003012537-844784001
uniesport srl;agriculture_livestock;dried_fruits;;wholesaler;via fratelli cervi 33 | 01038 soriano nel cimino - italy;soriano nel cimino - italy;1038.0;italy;dried fruits | hazelnuts | almonds | almond paste | toasted hazelnuts;uniesport company is the direct producer of hazelnuts tonda gentile romana and derivatives like roasted hazelnuts, diced roasted hazelnuts, powder of roasted hazelnuts and hazelnut pasta, both conventional and organic products. we also export different types of dried fruits as well as different types of semi-finished products: almond paste, pistachio paste, pine nuts paste, tiger nuts paste, walnut paste, the same thing for grain and flour. we began in the sixties in viterbo province, almost 60km from rome in the district of soriano nel cimino, an area extensively used for hazelnut production. in this renowned region we own more than 100 hectares of hazelnut trees. in the year 1996 we entered into a partnership with cooperative ecolazio, which brings together more than 200 of the area’s farmers. all the raw ingredients harvested by the cooperative’s farmers are processed on an exclusive basis by uniesport, the cooperative’s trusted, preferred partner. in order to satisfy the demands of the confectionary industry, our company has grown to cover an area of approximately 9000m2, incorporating various buildings and plants in order to provide our finished products. our most well-known product is the “hazelnut tonda gentile romana”, which we have proudly produced for over 20 years. in order to offer our customers the widest possible selection of products, we also collaborate with the best producers of italian almonds, walnuts of sorrento, pine nuts and pistachios.;11.0;50.0;;False;1965.0;https://www.uniesport.it;;uniesport-srl_00000005466322-838336001
d.a.r. srl;agriculture_livestock;dried_fruits;;manufacturer/ producer;via provinciale per lauro 34 | 83023 lauro - italy;lauro - italy;83023.0;italy;dried fruits | hazelnuts | products for breakfast and yogurt | italian walnuts | chocolate with hazelnuts;dar begins with a commercial nature, it started to to transform agricultural products, especially in dried fruit and nuts mostly hazelnuts and walnuts. during these years the management picked the different favorable offers from the market. the main business of the is represented by cracking of walnuts and hazelnuts, from which derivy most of the sells product range is not exhausted in this. many other products we have after roasting process. the hazelnuts whole peeled and roasted, the hazelnuts diced, hazelnut meal and the hazelnut paste, represent a production that is gaining above all markets especially in confectionary sector. together to this in our product range we have other raw materials such as pistachios, pumpkin seeds and many other products destined to the large distribution posible in different packaging from 30 grams to 1 kilo ideal for the catering.;11.0;50.0;;False;;http://www.darsrl.it;;dar-srl_00000004629588-437432001
irasco;agriculture_livestock;dried_fruits;;wholesaler;street anton giulio barrili | 16143 genova - italy;genova - italy;16143.0;italy;dried fruits | dried fruit | saffron;iran’s four season climate along with its incredible potentials to raise any kind of fresh fruit in large amounts, makes it the best producer of dried fruit flakes in the world. rich in proteins, vitamins, minerals and dietary fiber, dried fruits make a delicious and healthy snack. relying on rich past activities in trading all around the world, delidried has started dried fruit exports with great mission to provide healthy food in affordable price. our vision is to be the company whom provides health and joy to people all around the world. through our company in italy we ship to all over the world. highly committed to regarding the customers rights, delidried provides you the best grades of dried fruits from the best quality farms of iran. enjoy the best !;201.0;500.0;;False;;;;irasco_00000005373181-686219001
new elba vigevano s.r.l.;agriculture_livestock;dried_fruits;;distributor;v.le petrarca 25 | 27029 vigevano - italy;vigevano - italy;27029.0;italy;fruits, dried | 100% organic without coloring;~with a growing of 30% in sales in 2020 our natural products has satisfied the expectations of the customers. we carry bios and agricert certification. our production is fully without coloring, without preservatives, without added sugar. fruit is 80% of italian origin while vegetables are 100% of italian origin. our range of product includes: fruits, vegetable, preparation for soups, ratatouille, edible flowers all cold dehydrated; this means greater preservation of enzymes, vitamins and minerals~;1.0;10.0;;False;;https://www.newelba.com/food/ita/food.html;;new-elba-vigevano-srl_seac001906944-773027001
italfrutta di manno srl;agriculture_livestock;dried_fruits;;manufacturer/ producer;via diversivo acquachiara | 04022 km. 1.900-fondi - italy;km. 1.900-fondi - italy;4022.0;italy;fruits and vegetables - import-export | dried fruits | kiwi fruit | tinned kiwi fruit | plums;~the company was founded as f.lli di manno in 1976, setting out to make a name for itself thanks to the quality of the produce offered and the efficiency of its services. early hopes proved well-founded, with turnover and volumes growing steadily; in 1984 the corporate structure changed, taking the new name of italfrutta di manno srl~;51.0;100.0;registered office – parent company;False;;http://www.italfruttadimanno.it;;italfrutta-di-manno-srl_seac001741078-001
specialia srl;agriculture_livestock;dried_fruits;;manufacturer/ producer;19/21/23, v. scibilia | 95034 bronte - italy;bronte - italy;95034.0;italy;fruits, dried;the company specialia has been bringing you the delicate taste of its dop bronte pistachio products since 2013. for the exhibition of our products at the expo 2015, we decided to put the bronte pistachio in the spotlight and raise awareness among visitors by enabling them to recognise our "green gold" - a fruit with universally-acknowledged unique taste and aroma and an emerald green colour that sets it apart from other crops.;;;;False;;http://www.specialia.it;;specialia-srl_seac006304827-001
fabio torre srl;agriculture_livestock;dried_fruits;;wholesaler;via stazione roma nord, 50 | 01034 fabrica di roma - italy;fabrica di roma - italy;1034.0;italy;fruits, dried | hazelnuts | whole and shelled hazelnuts | toasted hazelnuts;the torre family's historic undertaking continuously roots out quality in the organic hazelnuts grown on the cimini hills, from hulling to drying, not to mention product processing. we primarily process raw hazelnuts, hulled, roast, pounded hazelnuts and produce semi-finished products such as nibbed hazelnuts, hazelnut spread and ground hazelnuts for pastry makers, ice cream makers and medium-to-large industrial bakeries.;;;;False;;http://www.fabiotorresrl.com;;fabio-torre-srl_seac005009533-001
pistacchio di bronte - spitaleri carmelo;agriculture_livestock;dried_fruits;;manufacturer/ producer;via formia, 2 | 95034 bronte - italy;bronte - italy;95034.0;italy;dried fruits | fresh pistachios | pistachios | packed pistachios;bronte, the village at the foot of mount etna, is renowned the world over for its production of excellent quality pistachios. bronte, the pistachio paradise, with a fruit whose taste and aroma are universally recognized as unique and special. green gold, that's the name given to the green pistachio from bronte, is the main economic earner of the vast territory of this small town in the etna region. mr carmelo spitaleri is one of the pistachio producers of bronte.;;;;False;;http://www.pistacchiodibronte.net;;pistacchio-di-bronte-spitaleri-carmelo_seac008390577-001
gelfruit italia srl;agriculture_livestock;dried_fruits;;manufacturer/ producer;strada statale 120 c/da cerro sn | 95012 castiglione di sicilia - italy;castiglione di sicilia - italy;95012.0;italy;dried fruits | almonds | pine nuts | pistachios | sultanas;located on the slopes of mount etna, gelfruit italia provides natural products from a non- polluted environment to the european and international markets. the extraordinary flavour of sicilian almonds, the exquisite taste of our hazelnuts, and the unique taste of our sicilian pistachios make any product from the confectionery and bakery industry special and authentic.;;;registered office – parent company;False;;http://www.gelfruit.it;;gelfruit-italia-srl_seac004679349-001
baldaiassa di baldizzone m.;agriculture_livestock;dried_fruits;;manufacturer/ producer;collina del negro, 2 | 14010 cortazzone - italy;cortazzone - italy;14010.0;italy;foods, gourmet | hazelnuts | dried fruit;the company baldaiassa di baldizzone m., is a manufacturer/ producer, which operates in the foods, gourmet industry. it also operates in the hazelnuts, and dried fruit industries. it is based in cortazzone, italy.;1.0;10.0;;False;;https://www.baldaiassa.it;;baldaiassa-di-baldizzone-m_00000005385459-702789001
diacoh;agriculture_livestock;dried_fruits;;wholesaler;via capolago, 1 | 20133 milano - italy;milano - italy;20133.0;italy;dried fruits;the company diacoh, is a wholesaler, founded in 2017, which operates in the dried fruits industry. it is based in milano, italy.;1.0;10.0;;False;2017.0;http://www.diacoh.com;;diacoh_00000005300521-608518001
nocciole di sicilia;agriculture_livestock;dried_fruits;;manufacturer/ producer;contrada licastro n. 38 | 98060 sant'angelo di brolo - italy;sant'angelo di brolo - italy;98060.0;italy;dried fruits;the company nocciole di sicilia, is a manufacturer/ producer, founded in 2019, which operates in the dried fruits industry. it is based in sant'angelo di brolo, italy.;1.0;10.0;registered office – parent company;False;2019.0;https://www.noccioledisicilia.com;;nocciole-di-sicilia_00000005355126-651663001
fo.ma olive bella di cerignola-societa' cooperativa;agriculture_livestock;dried_fruits;;manufacturer/ producer;via napoli, 109 | 71042 cerignola - italy;cerignola - italy;71042.0;italy;fruit | fruit & vegetables | citrus trees | traditional product | dried fruit;the company fo.ma olive bella di cerignola-societa' cooperativa, is a manufacturer/ producer, which operates in the fruit industry. it also operates in the fruit & vegetables, citrus trees, traditional product, and dried fruit industries. it is based in cerignola, italy.;;;registered office – parent company;False;;https://foma-olive-bella-di-cerignola-societa.business.site/?utm_source=gmb&utm_medium=referral;;foma-olive-bella-di-cerignolasocieta-cooperativa_seac005069544-001
fattore siculo srls;agriculture_livestock;dried_fruits;;manufacturer/ producer;via san pietro, 154 | 95031 adrano - italy;adrano - italy;95031.0;italy;import-export - food and agriculture | sicilian patisserie | dried fruit | semi-finished pastry products;the company fattore siculo srls, is a manufacturer/ producer, which operates in the import-export - food and agriculture industry. it also operates in the sicilian patisserie, dried fruit, and semi-finished pastry products industries. it is based in adrano, italy.;1.0;10.0;;False;;https://www.cererefattoresiculo.com;;fattore-siculo-srls_00000005384743-701442001
nuu srl;agriculture_livestock;dried_fruits;;distributor;via armida 6 | 44122 ferrara - italy;ferrara - italy;44122.0;italy;dried fruits;the company nuu srl, is a distributor, founded in 2018, which operates in the dried fruits industry. it is based in ferrara, italy.;1.0;10.0;registered office;False;2018.0;https://www.nuusrl.it;;nuu-srl_00000005328401-625400001
evergreen di pietro bonaccorso;agriculture_livestock;dried_fruits;;manufacturer/ producer;viale j. f. kennedy - zona artig. cap 22 | 95034 bronte - italy;bronte - italy;95034.0;italy;fruits, dried | olive oil pesto | roasted pistachios | crushed pistachios;the company evergreen di pietro bonaccorso, is a manufacturer/ producer, which operates in the fruits, dried industry. it also operates in the olive oil pesto, roasted pistachios, and crushed pistachios industries. it is based in bronte, italy.;1.0;10.0;;False;;http://www.pistacchioevergreen.it;;evergreen-di-pietro-bonaccorso_00000004627103-492085001
fantecchi snc;agriculture_livestock;dried_fruits;;manufacturer/ producer;via mattei 43 | 30020 marcon - italy;marcon - italy;30020.0;italy;dried fruits | peanuts;the company fantecchi snc, is a manufacturer/ producer, which operates in the dried fruits industry. it also operates in the peanuts industries. it is based in marcon, italy.;1.0;10.0;;False;;http://fantecchi.com;;fantecchi-snc_00000004706726-504295001
garden fruit s.r.l.s;agriculture_livestock;dried_fruits;;service provider;via giacomo longo,9 | 90145 palermo - italy;palermo - italy;90145.0;italy;dried fruits;the company garden fruit s.r.l.s, is a service provider, which operates in the dried fruits industry. it is based in palermo, italy.;101.0;200.0;;False;;http://gardenfruitsicilia.com;;garden-fruit-srls_00000005261817-575991001
dosicily.com;agriculture_livestock;dried_fruits;;manufacturer/ producer;via a.grassia 11a | 95034 bronte - italy;bronte - italy;95034.0;italy;dried fruits | pistachios | crushed pistachios;the company dosicily.com, is a manufacturer/ producer, which operates in the dried fruits industry. it also operates in the pistachios, and crushed pistachios industries. it is based in bronte, italy.;1.0;10.0;;False;;http://www.dosicily.com;;dosicilycom_00000004723668-524782001
imepa s.r.l.;agriculture_livestock;dried_fruits;;manufacturer/ producer;via fosso imperatore, lotto 1 | 84014 nocera inferiore - italy;nocera inferiore - italy;84014.0;italy;peppers and chillies | dried fruit;the company imepa s.r.l., is a manufacturer/ producer, founded in 1989, which operates in the peppers and chillies industry. it also operates in the dried fruit industries. it is based in nocera inferiore, italy.;11.0;50.0;registered office – parent company;False;1989.0;http://www.imepa.it;;imepa-srl_00000004694934-493357001
italpinoli dei f.lli paduano s.r.l.;agriculture_livestock;dried_fruits;;manufacturer/ producer;via giovanni xxiii, 56 | 80059 torre del greco - italy;torre del greco - italy;80059.0;italy;fruits, dried | food - import-export | packed pine nuts | pine nuts;the company italpinoli dei f.lli paduano s.r.l., is a manufacturer/ producer, founded in 1952, which operates in the fruits, dried industry. it also operates in the food - import-export, packed pine nuts, and pine nuts industries. it is based in torre del greco, italy.;1.0;10.0;registered office – parent company;False;1952.0;http://www.italpinoli.it;;italpinoli-dei-flli-paduano-srl_00000004618867-428511001
f.lli scandagli s.n.c. di scandagli marco e c.;agriculture_livestock;dried_fruits;;wholesaler;111 via provinciale lucchese | 51030 serravalle pistoiese - italy;serravalle pistoiese - italy;51030.0;italy;vegetables, edible roots and tubers | fruit | dried fruits;the company f.lli scandagli s.n.c. di scandagli marco e c., is a wholesaler, founded in 1977, which operates in the vegetables, edible roots and tubers industry. it also operates in the fruit, and dried fruits industries. it is based in serravalle pistoiese, italy.;;;registered office;False;1977.0;;;flli-scandagli-snc-di-scandagli-marco-e-c_seac001329981-001
big fruit;agriculture_livestock;dried_fruits;;wholesaler;costituzione | 47042 cesenatico - italy;cesenatico - italy;47042.0;italy;vegetables, edible roots and tubers | fruit | dried fruits;the company big fruit, is a wholesaler, which operates in the vegetables, edible roots and tubers industry. it also operates in the fruit, and dried fruits industries. it is based in cesenatico, italy.;;;registered office;False;;;;big-fruit_seac006409750-001
